0, salesforce, Salesforce Commerce Cloud, Veeva CRM, Appian, Jira Software, Braze, Pega Platform, Asana, Microsoft BI (MSBI), Outreach, SAP SuccessFactors, ,,,,,,,
1, shopify, Pirate Ship, Google Domains, React, UENI, Flipkart Seller Hub, Salesforce Commerce Cloud, Mirakl Marketplace Platform, Adyen, SAP Commerce Cloud, Joomla, ,,,,,,,
2, servicenow, BMC Helix ITSM (Remedy), Microsoft Dynamics 365, IBM Maximo, Amazon Web Services, ConnectWise Manage, Microsoft Power BI, SAP ERP, Pega Platform, Salesforce Service Cloud, Ivanti Service Manager, ,,,,,,,
3, hubspot, Adobe Marketo Engage, Pardot, SharpSpring from Constant Contact, Mailchimp, Salesforce Marketing Cloud Email Studio, Oracle CX Marketing (formerly Oracle Marketing Cloud), Microsoft Dynamics 365 Marketing, Braze, monday.com, HubSpot CRM, ,,,,,,,
4, kubernetes, Proxmox VE, Nomad, Hyper-V, VMware ESXi, Cloudera Manager, Hortonworks Data Platform, RabbitMQ, Oracle VM VirtualBox, Adobe Experience Manager, Amazon CloudWatch, ,,,,,,,
5, magento, Adobe Experience Manager, commercetools, Salesforce Commerce Cloud, SAP Commerce Cloud, Adobe Target, BigCommerce, Shopify Plus, Shopify, Kentico Xperience, Optimizely Commerce Cloud (formerly Episerver Commerce Cloud), ,,,,,,,
6, netsuite, Oracle Cloud ERP, Infor ERP, Oracle Hyperion, Odoo, SAP Business ByDesign, SAP Business One, Oracle JD Edwards EnterpriseOne, Sage Intacct, Oracle Cloud EPM, Microsoft Dynamics 365 Business Central (formerly Dynamics NAV), ,,,,,,,
7, zendesk, Microsoft Dynamics 365, Salesforce Service Cloud, Jira Service Management (Jira Service Desk), Freshdesk, ServiceNow IT Service Management, Salesforce, Asana, LiveAgent, Front, BMC Helix ITSM (Remedy), ,,,,,,,
8, slack, Nextcloud, Google Meet, Chanty, Chatter, Workplace from Meta, ClickUp, Cisco Jabber, Google Classroom, RingCentral MVP, Google Keep, ,,,,,,,
9, splunk, New Relic, Amazon CloudWatch, Datadog, PRTG, Zabbix, Darktrace, Microsoft Azure, AlienVault USM, ServiceNow IT Service Management, SolarWinds Kiwi Syslog Server, ,,,,,,,
10, zoom, GoTo Webinar, Whereby, Adobe Connect, Discord, Google Classroom, Microsoft Teams, Webex Meetings, AnyDesk, Amazon Chime, Blackboard Collaborate, ,,,,,,,
11, jira, Rally Software (formerly CA Agile Central), Azure DevOps Services, IBM Rational Team Concert, Polarion ALM, Atlassian Jira Align (formerly AgileCraft), Salesforce, Microsoft 365 (formerly Office 365), Jenkins, Jama Connect, Selenium, ,,,,,,,
12, marketo, HubSpot Marketing Hub, Pardot, SharpSpring from Constant Contact, Mailchimp, Oracle CX Marketing (formerly Oracle Marketing Cloud), Adobe Campaign, Adobe Experience Manager, Microsoft Dynamics 365, Microsoft Dynamics 365 Marketing, Salesforce Marketing Cloud Email Studio, ,,,,,,,
13, kronos, UKG Pro, Ascentis, UKG Dimensions, ADP Workforce Now, UKG Workforce Central, Workday HCM, Ceridian Dayforce HCM, TimeClock Plus, Paylocity, Oracle Cloud HCM, ,,,,,,,
14, stripe, WooCommerce, Marqeta, Google Pay, Paddle, Airwallex, Worldpay from FIS, Bolt, Payoneer, Paytm, TransferWise, ,,,,,,,
15, nimble, Cloze, Salesflare, Freshworks CRM (formerly Freshsales), OnePageCRM, LinkedIn Sales Navigator, Microsoft Dynamics 365, Pipedrive, HubSpot CRM, Solutionreach, Trello, ,,,,,,,
16, klaviyo, Privy, AWeber, ActiveCampaign, Salesforce Marketing Cloud Email Studio, Omnisend, Mautic, Sendinblue, Bloomreach Commerce Experience Cloud, MailerLite, SALESmanago CDP & Marketing Automation, ,,,,,,,
17, greenhouse, Workable, SmartRecruiters, Workday HCM, Breezy HR, iCIMS, Lever, Jobvite, BambooHR, SAP ERP, LinkedIn Talent Hub, ,,,,,,,
18, twilio, Amazon SNS, Google Authenticator, Amazon Chime, Sinch, Firebase, Vonage Communications APIs (formerly Nexmo), Zoom, OneSignal, Amazon Cognito, Amazon Connect, ,,,,,,,
19, crowdstrike, Microsoft Defender for Endpoint (formerly Microsoft Defender ATP), Darktrace, SentinelOne, Sophos Intercept X, Forcepoint DLP, Tanium, Cisco Secure Endpoint (formerly Cisco AMP), Trend Micro Apex One (formerly OfficeScan), Bitdefender GravityZone, Cloudflare, ,,,,,,,
20, okta, Amazon Cognito, Google Authenticator, Cisco Secure Access by Duo, Azure Active Directory, Workspace ONE Access (formerly VMware Identity Manager), Firebase, Transmit Security, SailPoint Identity Platform, OneLogin, JumpCloud, ,,,,,,,
21, drupal, Laravel PHP Framework, Umbraco CMS, Liferay Digital Experience Platform (DXP), Symfony, Salesforce Experience Cloud (formerly Salesforce Community Cloud), Wix, ASP.NET, Adobe Experience Manager, Plone, Kentico Xperience, ,,,,,,,
22, canvas, Google Classroom, Blackboard Learn, Canva, Brightspace, Moodle, Microsoft Teams, Articulate 360, Schoology Learning, Edmodo, Sakai, ,,,,,,,
23, teladoc, DocsApp, doxy.me, Amwell AW8, Maple, AGNES Interactive, BANYAN AURA Platform, Babylon Health, MDLIVE Virtual Medical Office, VCDoctor, ,,,,,,,,
24, advancedehr, UpToDate, eClinicalWorks, Epic, Intergy EHR, ClearCare, Practice Fusion, athenaClinicals, Allscripts Professional EHR, Insync Healthcare Solutions, CareLogic EHR, by Qualifacts, ,,,,,,
25, curemd, Kareo EHR, Epic, Practice Fusion, athenaClinicals, AdvancedPM, by AdvancedMD, eClinicalWorks, Intergy EHR, ClearCare, Allscripts Professional EHR, Insync Healthcare Solutions, CareLogic EHR, by Qualifacts, ,,,,
26, advancedbilling, athenaIDX (formerly Centricity Practice Solution from GE Healthcare), Kareo Medical Billing, Salesforce Health Cloud, athenaCollector, Artsyl ClaimAction, AllegianceMD Billing, Altapoint Medical, Medica Billing Solutions, Rectangle Health, ,,,,,,,,
27, wix, IONOS, by 1&1, Drupal, Medium, Blogger, Umbraco CMS, Elementor, Pixpa, Tumblr, Big Cartel, Sitecore Experience Manager, ,,,,,,
28, lever, Greenhouse, Workable, Breezy HR, JazzHR, Jobvite, Workday HCM, Bullhorn ATS & CRM, SmartRecruiters, ClearCompany, LinkedIn Talent Hub, ,,,,,,,
29, shipstation, Pirate Ship, ShipperHQ, Narvar, Easyship, CommerceHub, Linnworks, ShippingEasy, Happy Returns, Shippo, Ordoro, ,,,,,,,
30, mailchimp, Google Workspace (formerly G Suite), HubSpot Marketing Hub, Adobe Marketo Engage, Microsoft Dynamics 365, SMTP Email Relay Solutions, Salesforce Marketing Cloud Email Studio, Ascend, by Wix, Mailgun, from Pathwire, Google Forms, Amazon SES, ,,,,,
31, databricks, Azure HDInsight, Google BigQuery, AWS Glue, Amazon Redshift, Amazon EMR, Snowflake, Apache Spark, Cloudera Data Platform, Microsoft SQL Server, Amazon SageMaker, ,,,,,,,
32, postgresql, Azure SQL Database, MariaDB Platform, Amazon DynamoDB, Snowflake, DBeaver, Firebase, Oracle APEX, DB2, Progress OpenEdge, Cassandra, ,,,,,,,
33, tableau, Tableau Online, Microsoft Power BI, TIBCO Spotfire, Amazon QuickSight, Tableau Public, IBM SPSS, SAP Analytics Cloud, Microsoft Access, Tableau Prep, Datorama, ,,,,,,,
34, bamboohr, Hibob, Rippling, ADP Workforce Now, Namely, Sage People, Microsoft Dynamics 365, Greenhouse, Workday HCM, Gusto, Sage HRMS, ,,,,,,,
35, react, Laravel PHP Framework, WordPress, PowerApps, Symfony, Shopify, Salesforce Commerce Cloud, OutSystems, Squarespace, Mendix, CodeIgniter, ,,,,,,,
36, salesloft, Outreach, Gong, HubSpot Sales Hub, Groove, Calendly, Yesware, Revenue.io (formerly RingDNA), Pardot, Apollo, High Velocity Sales, ,,,,,,,
37, docker, Proxmox VE, VMware ESXi, Hyper-V, Terraform, Citrix Hypervisor, Nomad, Nagios Log Server, Git, Spinnaker, GitHub, ,,,,,,,
38, paylocity, ADP Workforce Now, Paycom, Paychex Flex, Paycor, UKG Pro, QuickBooks Desktop Pro, ADP TotalSource, UKG Ready, CATS ATS, Ceridian Dayforce HCM, ,,,,,,,
39, acumatica, Microsoft Dynamics 365 Business Central (formerly Dynamics NAV), Epicor Kinetic (formerly Epicor ERP), Odoo, Oracle Cloud ERP, Viewpoint Spectrum, SAP Business One, NetSuite ERP, Sage X3, Vista by Viewpoint, SAP S/4HANA, ,,,,,,,
40, nutanix, VMware vSAN, Dell EMC VxRail, Cisco HyperFlex, VMware ESXi, Proxmox VE, Scale Computing HC3, Red Hat Ceph Storage, vCenter Server, Hyper-V, Azure Virtual Machines, ,,,,,,,
41, procore, Bluebeam Revu, Autodesk Bim 360, PlanGrid, Trimble ProjectSight (Prolog), e-Builder, Oracle Aconex, InEight, Microsoft Project, Primavera Unifier, Sage 100 Contractor, ,,,,,,,
42, docusign, Adobe Acrobat Sign, Adobe Acrobat DC, Conga Sign, Conga Document Generation, PandaDoc, Microsoft Power Automate, PDFfiller, SignRequest, ziplogix Digital Ink, SignNow, ,,,,,,,
43, atlassian, OneNote, Microsoft 365 (formerly Office 365), Azure DevOps Server (formerly TMS), Microsoft Teams, Google Drive, GitHub, SharePoint, Nextcloud, WordPress, Google Workspace (formerly G Suite), ,,,,,,,
44, datadog, New Relic, Sentry, Splunk Enterprise, Dynatrace, PagerDuty, Elasticsearch, Amazon CloudWatch, Kibana, Azure Monitor, Firebase Crashlytics, ,,,,,,,
45, mindbody, Square POS, Acuity Scheduling, a Squarespace company, Booker, WellnessLiving, Zen Planner, Schedulicity, Shopify, TeamSnap, TeamUp, Pike13, ,,,,,,
46, sitecore, Adobe Experience Manager, Optimizely Web Experimentation, HCL Digital Experience (formerly IBM WebSphere Portal & Web Content Manager), Liferay Digital Experience Platform (DXP), Contentful, SAP Commerce Cloud, Drupal, Adobe Marketo Engage, Salesforce Commerce Cloud, Microsoft Dynamics 365 Marketing, ,,,,,,,
47, ringcentral, Zoom Phone, Google Voice, AT&T Office@Hand, Cisco Unified Communications Manager (Call Manager), 3CX, GoTo Connect, Twilio, Zoom, Slack, 8x8 X Series, ,,,,,,,
48, bullhorn, JobDiva, iCIMS, Microsoft Dynamics 365, Salesforce, HubSpot CRM, Vincere, Zoho Recruit, Greenhouse, Adapt by Bullhorn (formerly Bond AdaptUX), SAP Fieldglass, ,,,,,,,
49, squarespace, React, Medium, Klarna Checkout, Drupal, Blogger, Elementor, Joomla, BigCommerce, Adobe Experience Manager, Ecwid by Lightspeed, ,,,,,,,
50, mysql, SQL Developer, Microsoft Access, Elasticsearch, Google BigQuery, InfluxDB, Snowflake, DBeaver, SingleStore (formerly MemSQL), Oracle APEX, FileMaker Pro, ,,,,,,,
51, heroku, Cloudflare, Microsoft Azure, Firebase, DigitalOcean App Platform (Nanobox), Salesforce Lightning Platform (formerly Salesforce App Cloud), Amazon Elastic Container Service (Amazon ECS), Oracle Cloud Platform, WordPress, AWS Elastic Beanstalk, AWS Lambda, ,,,,,,,
52, macos, AddShoppers Social Login, eAssistance Pro (discontinued), Dell Endpoint Security Suite Enterprise, Crowdbooster (discontinued), OpenText Portal, Ayasdi Core, BookSteam, WellCycle InVision, LessAccounting, Infor CloudSuite Distribution, ,,,,,,,
53, coupa, SAP Ariba Procurement, Kyriba, Concur Travel and Expense, Zip Intake-to-Procure, Oracle Cloud ERP, JAGGAER (formerly SciQuest), Workday Financial Management/Revenue Management, Basware P2P, SAP ERP, Anaplan, ,,,,,,,
54, quip, Notion, Google Drive, Conga Document Generation, Upland Altify, Google Sheets, Chatter, Amazon Chime, Gainsight Customer Cloud, Confluence, Slack, ,,,,,,,
55, zipwhip, Twilio, EZ Texting, CallFire, SimpleTexting, ClickSend, Podium, TextMagic, Avochato, OpenMarket, from Infobip, Birdeye, ,,,,,,
56, solidworks, Revit, Siemens NX CAD, DraftSight, SketchUp, Autodesk Tinkercad, Rhino 3D, Navisworks, PTC Creo, Onshape, CorelCAD, ,,,,,,,
57, smartrecruiters, Greenhouse, iCIMS, LinkedIn Talent Hub, Workday HCM, Jobvite, ZipRecruiter, Workable, SAP SuccessFactors, JazzHR, Bullhorn ATS & CRM, ,,,,,,,
58, optimizely, Firebase, VWO, Adobe Target, AB Tasty, Salesforce Marketing Cloud Interaction Studio (formerly Evergage + MyBuys), Amplitude Analytics, LaunchDarkly, Sitecore Experience Manager, Adobe Experience Manager, SiteSpect, ,,,,,,,
59, epic, Meditech Electronic Health Records, Renaissance myON® Reader, eClinicalWorks, PointClickCare Core EHR Platform, Allscripts Professional EHR, Renaissance Accelerated Reader, EpicCare EMR, MatrixCare, NextGen Healthcare EHR, Applied Epic, ,,,,,,,
60, ultipro, ADP Workforce Now, UKG Ready, Ceridian Dayforce HCM, Workday HCM, Paycom, AWS Certificate Manager, UKG Dimensions, Paylocity, Oracle Cloud HCM, Salesforce, ,,,,,,,
61, github, SonarQube, Google Drive, Confluence, Perforce Helix Core, TeamCity, Google Workspace (formerly G Suite), AccuRev, IBM Rational Team Concert, Microsoft Teams, Micro Focus Dimensions CM, ,,,,,,,
62, qualtrics, SurveyMonkey, Medallia, Google Forms, QuestionPro, LimeSurvey, REDCap, Typeform, IBM SPSS, Alchemer, formerly SurveyGizmo, Microsoft Power BI, ,,,,,,
63, gotowebinar, Zoom, Microsoft Teams, Vimeo, ON24, Hopin, Webex Webinars (formerly Webex Events), Amazon Chime, EverWebinar, BrightTALK, Webex Meetings, ,,,,,,,
64, trustarc, OneTrust, Osano, Cookiebot by Usercentrics, Archer, Collibra, LiveRamp, IBM Security Guardium, Netwrix Auditor, Crownpeak Universal Consent Platform, Varonis Data Classification Engine, ,,,,,,,
65, mongodb, MongoDB Atlas, Snowflake, InfluxDB, Amazon S3, RavenDB, Neo4j, Oracle Database, SQLite, Apache Kafka, Google BigQuery, ,,,,,,,
66, ethereum, Hyperledger Fabric, Waves, Algorand, CertiK, Chainlink Labs, Clause for DocuSign, ConsenSys Diligence, Hedera, NEM Platform (NIS1), ,,,,,,,,
67, five9, NICE CXone (formerly NICE inContact), Cisco Unified Contact Center, Webex Contact Center, RingCentral MVP, Talkdesk, Genesys Cloud CX (formerly Genesys Cloud), 8x8 Contact Center, Genesys PureConnect, Twilio, Zendesk Talk, ,,,,,,,
68, xero, SAP ERP, Sage 50cloud Accounting, QuickBooks Self-Employed, Microsoft Dynamics 365, Zoho Books, Sage Business Cloud Accounting, Exact Online, FreeAgent, Dext Prepare (with Receipt Bank), QuickBooks Desktop for Mac, ,,,,,,,
69, elasticsearch, Amazon CloudWatch, Apache Kafka, Apache Spark, Azure Monitor, MongoDB Atlas, Zabbix, Amazon DynamoDB, Dynatrace, New Relic, Microsoft Power BI, ,,,,,,,
70, paycom, ADP Workforce Now, Paylocity, UKG Pro, Paycor, Paychex Flex, Gusto, UKG Ready, TribeHR (discontinued), Workday HCM, Ceridian Dayforce HCM, ,,,,,,,
71, braintree, Authorize.Net, Worldpay from FIS, Adyen, Shopify, Paddle, CyberSource, TransferWise, Google Pay, Stripe, Fiserv (First Data) - ICICI Merchant Services, ,,,,,,,
72, smartsheet, Microsoft Excel, Microsoft Project, monday.com, Jira Software, Salesforce, SharePoint, Azure DevOps Server (formerly TMS), Asana, MindManager, Microsoft Planner, ,,,,,,,
73, selenium, Postman, Microsoft Power Automate, Tricentis Tosca, Katalon Studio, Jira Software, Testim, IBM Rational Functional Tester, Worksoft, TestComplete, Ranorex Studio, ,,,,,,,
74, olapic, Curalate, Yotpo, Bazaarvoice Platform, TINT, Sprinklr Modern Marketing & Advertising, Percolate, Matomo Analytics (formerly Piwik), Meltwater Social Influencer Management (Klear), Canva, ,,,,,,,,
75, jenkins, Terraform, IBM UrbanCode Deploy, Jira Software, Control-M, Digital.ai Release (formerly XebiaLabs XL Release), Octopus Deploy, Azure DevOps Services, SonarQube, JFrog Artifactory, AWS CodePipeline, ,,,,,,,
76, cvent, SurveyMonkey, Qualtrics, Confirmit, Alida CXM (formerly Vision Critical), ProProfs Quiz Maker, Google Forms, Formstack Forms, Typeform, Wufoo, Jotform, Alchemer, formerly SurveyGizmo, AskNicely, ,,,,
77, curalate, Hootsuite, Sprout Social, Olapic, Sprinklr Social Engagement & Sales, Yotpo, Later, TINT, Iconosquare, Khoros Marketing (Formerly Spredfast + Lithium), Woobox, ,,,,,,,
78, sentinelone, Sophos Intercept X, CrowdStrike Falcon, Bitdefender GravityZone, Darktrace, Microsoft Defender for Endpoint (formerly Microsoft Defender ATP), Symantec Data Loss Prevention, Webroot Antivirus + Internet Security Complete (SecureAnywhere), Trend Micro Apex One (formerly OfficeScan), Symantec Endpoint Security, Norton, ,,,,,,,
79, icims, Workday HCM, Bullhorn ATS & CRM, Greenhouse, SmartRecruiters, Jobvite, JobDiva, Oracle Cloud HCM, SAP SuccessFactors, Avature ATS, Paylocity, ,,,,,,,
80, ncino, S&P Capital IQ, Premier Bank Platform, Encompass from Ellie Mae, ACES Web Audit Technology, FinnOne Neo, Kabbage Platform (Radius Intelligence), FinnOne Neo Cloud, Calyx Point, LoanPro, Mortgage Servicer, TValue, ,,,,,,
81, hotjar, Twilio Segment, Smartlook, Mixpanel, Pendo.io, Inspectlet, Matomo Analytics (formerly Piwik), Adobe Analytics, Amplitude Analytics, Lucky Orange, Google PageSpeed Insights, ,,,,,,,
82, zenefits, TriNet, Rippling, Justworks, BambooHR, isolved, TribeHR (discontinued), Sage HRMS, Namely, Paycom, Gusto, ,,,,,,,
83, surveymonkey, Qualtrics, Jotform, Cognito Forms, Google Forms, LimeSurvey, Alchemer, formerly SurveyGizmo, Typeform, Medallia, REDCap, Mailchimp, ,,,,,,
84, intercom, Autopilot, Braze, Pendo.io, HubSpot Marketing Hub, Appcues, Mailchimp, Jira Service Management (Jira Service Desk), LiveChat, Drift, Twilio, ,,,,,,,
85, jda, SAP Integrated Business Planning, SAP SCM, Oracle SCM Cloud, Relex Solutions, Anaplan, Coupa Supply Chain Design & Planning (Llamasoft), Microsoft Dynamics AX (Dynamics 365 for Finance and Operations), discontinued, Blue Yonder Luminate Logistics (formerly RedPrairie, JDA WMS), OMS Office Master System, Manhattan Active Supply Chain, ,,,,,
86, trinet, ADP TotalSource, Gusto, Paychex Flex, Zenefits, Justworks, Rippling, Papaya Global, Insperity ExpensAble, Paycor, ADP Workforce Now, ,,,,,,,
87, rancher, Rafay, Nomad, Red Hat OpenShift, CloudFoundry, Google Kubernetes Engine, GitLab, Mirantis Kubernetes Engine (Docker Enterprise), Nutanix AOS, Docker, Dell EMC PowerFlex (formerly VxFlex), ,,,,,,,
88, sailpoint, Azure Active Directory, Varonis Data Security Platform, The Okta Identity Cloud, One Identity Identity Manager, SAP NW Identity Management, CyberArk Privileged Account Security, Oracle Identity Cloud Service, Amazon Cognito, Tivoli Identity Manager, BetterCloud, ,,,,,,,
89, mendix, OutSystems, PowerApps, Salesforce, React, Pega Platform, Appian, Oracle APEX, .NET, UiPath Enterprise RPA Platform, Microsoft Power BI, ,,,,,,,
90, brightcove, Vimeo, Kaltura, JW Player, Wistia, Zoom, ON24, Vidyard, BrightTALK, Akamai, Amazon CloudFront, ,,,,,,,
91, listrak, Klaviyo, Wunderkind, formerly BounceX, Bluecore, HubSpot Marketing Hub, Salesforce Marketing Cloud Email Studio, Emarsys, Twilio SendGrid, Braze, Mailchimp, Bronto Marketing Platform (discontinued), ,,,,,,
92, aptean, Zoho CRM, Microsoft Dynamics 365, HCL Unica, Oracle Siebel Enterprise Marketing Suite (discontinued), Salesforce, HubSpot CRM, Insightly, Pipedrive, Sugar Sell (SugarCRM), Oracle CX Sales (formerly Oracle Engagement Cloud and Oracle Sales Cloud), Oracle CRM, ,,,,,,
93, phorest, Mapp Intelligence, powered by Webtrekk, MINDBODY, TeamSnap, Omnify, TeamUp, Shortcuts, Arbox, ClubHouse Online, Daxko Spectrum, WellnessLiving, ,,,,,,
94, hopin, Zoom Video Webinar, Microsoft Teams, Whova, Zoom, Bizzabo, ON24, GoTo Webinar, Hubilo, Splash Event Marketing Platform, Kaltura, ,,,,,,,
95, fireeye, Microsoft Defender for Endpoint (formerly Microsoft Defender ATP), Symantec Messaging Gateway, CrowdStrike Falcon, Proofpoint Email Protection, McAfee Endpoint Security, Symantec Endpoint Security, Microsoft 365 (formerly Office 365), Trend Micro Apex One (formerly OfficeScan), Palo Alto Networks WildFire, Cisco Secure Firewall, ,,,,,,,
96, birdeye, Podium, Trustpilot, Yext, Sprinklr Social Engagement & Sales, Yotpo, BrightLocal, Stamped.io, Google Business Profile, PowerReviews, Zipwhip, ,,,,,,,
97, brighttalk, ON24, GoTo Webinar, Brightcove Video, Vimeo, Zoom Video Webinar, Hopin, Flipgrid, Zoom, Vidyard, Wistia, ,,,,,,,
98, tensorflow, Amazon SageMaker, MATLAB, Jupyter Notebook, H2O, KNIME Analytics Platform, Azure Machine Learning, IBM Watson Studio, Oracle Machine Learning, Kira, SAS Advanced Analytics, ,,,,,,,
99, bluecore, Salesforce Marketing Cloud Email Studio, Klaviyo, Braze, Listrak, Bronto Marketing Platform (discontinued), Mailchimp, Adobe Experience Manager, Twilio SendGrid, HubSpot Marketing Hub, iContact, ,,,,,,,
100, nintex, Microsoft Power Automate, PowerApps, K2 Software, SharePoint Designer (discontinued), ServiceNow IT Service Management, Kissflow, Azure Logic Apps, Conga Document Generation, DocuSign, Mendix, ,,,,,,,
101, freshdesk, ActiveCampaign, Zendesk Support Suite, Zoho Desk, Freshworks CRM (formerly Freshsales), Jira Service Management (Jira Service Desk), ServiceNow IT Service Management, HubSpot CRM, Salesforce Service Cloud, Microsoft Dynamics 365, LiveAgent, ,,,,,,,
102, commvault, AWS Backup, Veeam Backup & Replication, Tivoli Storage Manager, Rubrik, Dell EMC Networker, Zerto, PowerProtect DD (formerly Dell EMC Data Domain), Cohesity Helios, Dell EMC Avamar, HPE StoreOnce, ,,,,,,,
103, kentico, Umbraco CMS, Drupal, Adobe Experience Manager, WordPress, Kontent by Kentico, Liferay Digital Experience Platform (DXP), Adobe Commerce (Magento Commerce), DNN Platform, Sitecore Experience Manager, Progress Sitefinity, ,,,,,,,
104, hireright, Accurate Background, SterlingOne (TalentWise), HireVue, Checkr, GoodHire, ADP Workforce Now, Paycom, Hireology, LinkedIn Talent Hub, Ceridian Dayforce HCM, ,,,,,,,
105, asana, Salesforce, monday.com, Microsoft To Do (formerly Wunderlist), Google Tasks, ClickUp, Azure DevOps Services, Pipedrive, Hive, HubSpot Marketing Hub, Smartsheet, ,,,,,,,
106, syspro, SAP ERP, Epicor Kinetic (formerly Epicor ERP), Microsoft Dynamics 365 Business Central (formerly Dynamics NAV), Microsoft Dynamics 365, Xero, NetSuite ERP, Infor VISUAL, Sage X3, Microsoft Dynamics GP, Sage 300cloud, ,,,,,,,
107, bizible, Google Analytics, Datorama, Adobe Analytics, Full Circle Insights, 6sense, HubSpot Marketing Hub, Oracle CX Marketing (formerly Oracle Marketing Cloud), Salesforce, LeanData, Domo, ,,,,,,,
108, onelogin, Azure Active Directory, The Okta Identity Cloud, JumpCloud, Cisco Secure Access by Duo, Amazon Cognito, PingOne Cloud Platform, Workspace ONE Access (formerly VMware Identity Manager), Imprivata OneSign, Univention Corporate Server (UCS), 1Password, ,,,,,,,
109, bettercloud, Workato, The Okta Identity Cloud, Blissfully, SailPoint Identity Platform, ServiceNow IT Service Management, Netskope CASB, Varonis Data Security Platform, VMware Cloud Director, Cisco CloudLock, Splunk Enterprise, ,,,,,,,
110, appian, Salesforce, PowerApps, Pega Platform, OutSystems, Camunda Platform, Appium, Mendix, IBM Business Automation Workflow, Oracle APEX, Microsoft Power Automate, ,,,,,,,
111, control-m, Jenkins, Dollar Universe Workload Automation, CA Workload Automation, UiPath Enterprise RPA Platform, CA Scheduler Job Management, AWS Batch, ActiveBatch Workload Automation, Redwood Business Process Automation - Workload Edition, Informatica Application ILM, Ansible, ,,,,,,,
112, paycor, Paylocity, Paycom, ADP Workforce Now, Paychex Flex, QuickBooks Online, UKG Pro, Workday HCM, SAP Core HR and Payroll, TriNet, BambooHR, ,,,,,,,
113, talend, AddShoppers Social Login, eAssistance Pro (discontinued), Dell Endpoint Security Suite Enterprise, Crowdbooster (discontinued), OpenText Portal, Ayasdi Core, BookSteam, WellCycle InVision, LessAccounting, Infor CloudSuite Distribution, ,,,,,,,
114, teamviewer, Chrome Remote Desktop, Microsoft Teams, VNC Connect, Apple Remote Desktop, Radmin Remote Administrator, Google Classroom, AnyDesk, LogMeIn Pro, NoMachine Enterprise Desktop, GoToAssist, ,,,,,,,
115, akamai, AWS WAF, Cisco Umbrella, Azure CDN, Zscaler Internet Access, NGINX, Google Cloud CDN, Amazon Route 53, Amazon CloudFront, Imperva CDN, Cloudflare, ,,,,,,,
116, plivo, Twilio, WhatsApp Business, Vonage Communications APIs (formerly Nexmo), Bandwidth, MessageBird, Amazon SNS, Sinch, Google Voice, TextMagic, Nextiva Business Phone Service, ,,,,,,,
117, trello, Microsoft To Do (formerly Wunderlist), Azure DevOps Services, Google Tasks, Microsoft Teams, OneNote, Nextcloud, Miro, HubSpot Marketing Hub, Bitrix24, Microsoft Project, ,,,,,,,
118, yotpo, Trustpilot, Stamped.io, Growave, Reviews.io, Podium, Bazaarvoice Platform, Birdeye, ReferralCandy, PowerReviews, Tango Card, ,,,,,,,
119, gitlab, SonarQube, Azure DevOps Services, AWS CodePipeline, Jira Software, Redmine, JFrog Artifactory, Apache Subversion, Spyder, Trello, Bamboo, ,,,,,,,
120, spoke, Jira Service Management (Jira Service Desk), BMC Helix ITSM (Remedy), Freshservice, BMC Helix Remedyforce, ServiceNow IT Service Management, HaloITSM, Combodo  iTop, TOPdesk, SolarWinds Service Desk, SysAid, Autotask PSA, Cherwell Service Management, ,,,,,
121, clearcompany, iCIMS, Greenhouse, Engagedly, JazzHR, Workable, Insperity PerformSmart, Avionté Software, Lever, Zoho Recruit, TribeHR (discontinued), ,,,,,,,
122, zuora, Salesforce CPQ, SAP ERP, SAP Commerce Cloud, Chargebee, Conga CPQ, Recurly, Stripe, NetSuite ERP, WooCommerce Subscriptions, Microsoft Dynamics 365, ,,,,,,,
123, blissfully, BetterCloud, ServiceNow IT Service Management, Quantum Metric, ShareGate, ManageEngine AssetExplorer, Rippling, FullStory, Spiceworks Help Desk, SolarWinds Service Desk, SailPoint Identity Platform, ,,,,,,,
124, joomla, Laravel PHP Framework, Shopify, Elementor, Moodle, Umbraco CMS, Yoast Wordpress SEO Plugins, Plone, SharePoint, Squarespace, Node.js, ,,,,,,,
125, weebly, Blogger, Elementor, Medium, WooCommerce, Ecwid by Lightspeed, Big Cartel, Yoast Wordpress SEO Plugins, Klarna Checkout, LiveJournal, BigCommerce, ,,,,,,,
126, informatica, Control-M, Apache Kafka, Alation, IBM Watson Knowledge Catalog, Veritas Enterprise Vault, OpenText Archive Center, Delphix, Oracle Data Integrator, Apache Camel, Informatica MDM, ,,,,,,,
127, emaint, Maintenance Connection CMMS, ServiceChannel, Infor EAM, UpKeep Maintenance Management, Asset Essentials™ (fomerly Help Desk + Asset Essentials), Hippo CMMS, Fiix Software, CloudApper CMMS, FAMIS 360, CloudApper Facilities, ,,,,,,,
128, talkdesk, Genesys Cloud CX (formerly Genesys Cloud), Zendesk Talk, NICE CXone (formerly NICE inContact), Cisco Unified Contact Center, Five9, GoContact, Zoom Phone, Genesys PureConnect, Dialpad Talk, Twilio, ,,,,,,,
129, nexmo, Twilio, WhatsApp Business, Sinch, Amazon SNS, Plivo, Telegram, Vonage Business Communications, Telynx, Bandwidth, Google Voice, ,,,,,,,
