264, tanium, CrowdStrike Falcon, Microsoft Endpoint Manager (Microsoft Intune + SCCM), Tenable.sc (formerly SecurityCenter), Qualys Cloud Platform, Nessus, Microsoft Defender for Endpoint (formerly Microsoft Defender ATP), Rapid7 InsightVM (Nexpose), Ivanti Unified Endpoint Manager, Ansible, VMware Carbon Black EDR, ,,,,,,,
265, targetprocess, Atlassian Jira Align (formerly AgileCraft), Jira Software, IBM Rational Team Concert, Broadcom Clarity (formerly CA Project Portfolio Management), productboard, KeyedIn Enterprise, monday.com, Rally Software (formerly CA Agile Central), Azure DevOps Services, Asana, ,,,,,,,
266, fuze, RingCentral MVP, Zoom, Microsoft Teams, 8x8 X Series, eFax, NICE CXone (formerly NICE inContact), Vonage Business Communications, GoTo Connect, Slack, Alvaria Compliant Outreach (Noble Systems), ,,,,,,,
267, algolia, Elasticsearch, Yext, Searchspring, Coveo Relevance Cloud, Azure Cognitive Search, Amazon CloudSearch, Lucidworks Fusion, Elastic Enterprise Search (Swiftype), Salesforce Commerce Cloud, SAP Commerce Cloud, ,,,,,,,
268, webinarjam, EverWebinar, BigMarker, GoTo Webinar, Microsoft Teams, ClickMeeting, LiveWebinar, ON24, Zoom Video Webinar, Zoom, Hopin, ,,,,,,,
269, monsido, accessiBe, Siteimprove, Silktide, BrightEdge, Crownpeak DQM, Sitemorse, AudioEye, Compliance Sheriff, from AppGate, DubBot, Equally AI, Equalweb, ,,,,,
270, cyberark, HashiCorp Vault, Azure Active Directory, Delinea Secret Server (formerly Thycotic Secret Server), BeyondTrust Password Safe, The Okta Identity Cloud, BeyondTrust Endpoint Privilege Management, 1Password, Oracle Identity Cloud Service, ManageEngine Password Manager Pro, Workspace ONE Access (formerly VMware Identity Manager), ,,,,,,,
271, doubleclick, The Trade Desk, Google Analytics, Sizmek Ad Suite, Adobe Marketing Cloud, Google Tag Manager, Adobe Advertising Cloud, Google Ads, Marketing Solutions by Criteo, Adobe Audience Manager, AdRoll, ,,,,,,,
272, rackspace, Amazon Web Services, Oracle Cloud Infrastructure, Microsoft Azure, DigitalOcean, Cloudways, Navisite Managed Infrastructure Services (NaviCloud), IBM Cloud Bare Metal Servers, Red Hat OpenShift, Liquid Web, Pantheon, ,,,,,,,
273, swarm, Azure Kubernetes Service (AKS), Microsoft BizTalk, Nomad, Red Hat OpenShift, GoDaddy Container-as-a-Service (ElasticHosts, Springs.io), discontinued, Kubernetes, HashiCorp Vault, Helm, VMware ESXi, Microsoft IIS, ,,,,,
274, nextiva, Microsoft Teams, Google Voice, Comcast Business VOIP (VoiceEdge), Zoom, Dialpad Talk, JustCall, RingCentral MVP, GoTo Connect, Zoom Phone, Zoho CRM, ,,,,,,,
275, saviynt, One Identity Identity Manager, NetIQ Identity Manager, Avanan, Microsoft Defender for Cloud Apps, Netskope CASB, Cisco CloudLock, Forcepoint CASB, McAfee MVISION Cloud, CloudSOC CASB, Bitglass, Oracle CASB Cloud Service, Proofpoint Cloud App Security Broker (Proofpoint CASB), ,,,,,
276, automox, AddShoppers Social Login, eAssistance Pro (discontinued), Dell Endpoint Security Suite Enterprise, Crowdbooster (discontinued), OpenText Portal, Ayasdi Core, BookSteam, WellCycle InVision, LessAccounting, Infor CloudSuite Distribution, ,,,,,,,
277, adyen, Worldpay from FIS, Shopify, Stripe, Klarna Checkout, PayPal Payments Pro, CyberSource, Braintree, a PayPal service, Marqeta, TransferWise, Authorize.Net, ,,,,,,
278, fivetran, Matillion, dbt, Azure Data Factory, AWS Glue, Stitch, from Talend, Talend Data Integration, Apache Spark, Supermetrics, Oracle GoldenGate, Striim, ,,,,,,
279, onestream, Anaplan, Oracle Cloud EPM, Workday Adaptive Planning, Oracle Hyperion, SAP BPC (Business Planning and Consolidation), Wolters Kluwer CCH® Tagetik, Vena, BlackLine, IBM Planning Analytics with Watson, Planful (formerly Host Analytics), ,,,,,,,
280, benefitfocus, SAP SuccessFactors, bswift, UKG Pro, Workday HCM, TriZetto Core Administration (Facets, QNXT and QicLink), Ceridian Dayforce HCM, PDS Vista, PlanSource, Gusto, ADP GlobalView Payroll, ,,,,,,
281, prometheus, Zabbix, Nagios Core, New Relic, Sentry, Icinga, Dynatrace, Splunk Infrastructure Monitoring, formerly SignalFx, Elasticsearch, Microsoft System Center Operations Manager (SCOM), Amazon CloudWatch, ,,,,,,
282, freshservice, Jira Service Management (Jira Service Desk), ServiceNow IT Service Management, Microsoft Endpoint Manager (Microsoft Intune + SCCM), TOPdesk, Lansweeper, ServiceNow Governance, Risk, and Compliance, ManageEngine ServiceDesk Plus, Ivanti ITSM Service Desk, powered by Heat (formerly LANDESK Service Desk), Zendesk Support Suite, Freshdesk, ,,,,
283, jimdo, WebWave, WordPress, Salesforce CMS, Drupal, Wix, Joomla, Squarespace, Adobe Experience Manager, Sitecore Experience Manager, Magnolia, ,,,,,,,
284, jive, Genesys Cloud CX (formerly Genesys Cloud), Confluence, Khoros Communities (Formerly Spredfast + Lithium), Microsoft Yammer, SharePoint, Moodle, MangoApps, Microsoft Teams, Vibe HCM, Verint Community (Telligent), ,,,,,,,
285, entrata, Yardi Voyager, OneSite Leasing and Rents, SAP ERP, AppFolio Property Manager, Property Matrix, VTS, RealPage Portfolio Asset Management, MRI Residential Management, CoStar Real Estate Manager, Dotloop, ,,,,,,,
286, yesware, HubSpot Sales Hub, Mailtrack, SalesHandy, Salesloft, Outreach, Bananatag (discontinued), ContactMonkey, Salesforce Inbox, Mailchimp, Cirrus Insight, ,,,,,,,
287, nagios, Zabbix, Prometheus, Elasticsearch, Icinga, Nagios Log Server, Observium, OpenNMS, New Relic, Nagios XI, Splunk Enterprise, ,,,,,,,
288, eventbrite, Splash Event Marketing Platform, Constant Contact, Whova, SignUpGenius, Brown Paper Tickets, Ticket Tailor, Mailchimp, Cvent Event Management, Jotform, Hopin, ,,,,,,,
289, volusion, WordPress, WooCommerce, BigCommerce, ChannelAdvisor, Miva, Shopify, Weebly, CS-Cart Multi-Vendor Marketplace Platform, HubSpot Marketing Hub, Salesforce Commerce Cloud, ,,,,,,,
290, avalara, TaxJar, Vertex, ONESOURCE, Sovos Intelligent Compliance Cloud, QuickBooks Online, Canopy, CCH SureTax, ADP SmartCompliance, LOVAT, Thomson Reuters CS Professional Suite, ,,,,,,,
291, knowbe4, Proofpoint Security Awareness Training, Cofense PhishMe, Microsoft Defender for Endpoint (formerly Microsoft Defender ATP), Sophos Phish Threat, Infosec IQ, Mimecast Cloud Archive, Barracuda Security Awareness Training (formerly Barracuda Phishline), Mimecast Information Protection, ESET Endpoint Security, Cofense LMS, ,,,,,,,
292, lightstep, LogicMonitor, Splunk Enterprise, New Relic, Datadog, DupeCatcher, Dynatrace, Amazon CloudWatch, Sumo Logic, InfluxDB, Retrace, Moogsoft, Sensu, ,,,,,
293, zapier, Microsoft Power Automate, Automate.io, Zoho Flow, Azure Logic Apps, Workato, HubSpot Marketing Hub, PowerApps, Integromat, Mailchimp, Appian, ,,,,,,,
294, affirm, Shopify, GoDaddy, Squarespace, Ecwid by Lightspeed, CS-Cart Multi-Vendor Marketplace Platform, Klarna Checkout, SAP Commerce Cloud, Wix, WooCommerce, Shopify Plus, ,,,,,,,
295, marklogic, MongoDB, Snowflake, Elasticsearch, MySQL, Cassandra, Talend Data Integration, Azure Cosmos DB, Cloudera Enterprise Data Hub, Teradata Data Warehouse Appliance 2850, Hadoop, ,,,,,,,
296, dataminr, Everbridge Mass Notification, Meltwater Media Intelligence Platform, Sprinklr Modern Research, expert.ai NL Suite (formerly Cogito Intelligence Platform from Expert System), Talkwalker, TIBCO Streaming, Hootsuite Impact, Cision Communications Cloud, Brandwatch, NetBase Quid, ,,,,,,,
297, opencart, PrestaShop, nopCommerce, Drupal, Klarna Checkout, Shopify, Joomla, Wix, X-Cart, Dokan, SAP Commerce Cloud, ,,,,,,,
298, confluent, VMware Tanzu Application Catalog (Bitnami), IBM Event Streams, Amazon Kinesis, Google Cloud Pub/Sub, Cloudera Manager, Apache Camel, TIBCO Streaming, Apache Kafka, Anypoint Platform, Databricks Lakehouse Platform, ,,,,,,,
299, datarobot, Azure Machine Learning, Amazon SageMaker, H2O, Dataiku DSS, Databricks Lakehouse Platform, Google Cloud AI, SAS Visual Analytics, Jupyter Notebook, RStudio, Alteryx, ,,,,,,,
300, snyk, Black Duck Software Composition Analysis (SCA), Veracode, SonarQube, FOSSA, Checkmarx, Micro Focus Fortify on Demand, Nessus, WhiteSource, Metasploit, GitLab, ,,,,,,,
301, accessibe, Siteimprove, Monsido, Silktide, Lucky Orange, Google Analytics, Crownpeak DQM, Sitemorse, AudioEye, Compliance Sheriff, from AppGate, DubBot, Equally AI, Equalweb, ,,,,
302, bitglass, CrowdStrike Falcon, Palo Alto Networks Prisma Cloud, Avanan, Netskope CASB, Microsoft Defender for Cloud Apps, Lookout, Zscaler Internet Access, Cloudflare, McAfee MVISION Cloud, Lacework, ,,,,,,,
303, saltstack, Terraform, Azure DevOps Services, Ansible, VMware Cloud Director, Cisco Intersight, Morpheus, Jenkins, Red Hat OpenStack Platform, Oracle Cloud Infrastructure, Microsoft Endpoint Manager (Microsoft Intune + SCCM), ,,,,,,,
304, gainsight, ChurnZero, Salesforce, Totango, Planhat, Pendo.io, Qualtrics, Microsoft Dynamics 365, HubSpot CRM, Quip, ClientSuccess, ,,,,,,,
305, flow, Asana, monday.com, TickTick, Sitetracker, Nifty, Jira Software, Kaltura, Akamai, Paymo, Atlassian Jira Align (formerly AgileCraft), ,,,,,,,
306, figma, Miro, Marvel, Proto.io, Justinmind, Adobe Illustrator, MURAL (formerly Mural.ly), Canva, Balsamiq, UXPin, Lucidchart, ,,,,,,,
307, grafana, Google Data Studio, Amazon CloudWatch, Microsoft Power BI, Plotly Chart Studio, New Relic, Looker, PRTG, Redash, TIBCO Spotfire, Tableau Public, ,,,,,,,
308, lansweeper, PDQ Deploy, Microsoft Endpoint Manager (Microsoft Intune + SCCM), ManageEngine Desktop Central, Zabbix, PRTG, Spiceworks Help Desk, Microsoft System Center, Jira Service Management (Jira Service Desk), ManageEngine AssetExplorer, SolarWinds NPM, ,,,,,,,
309, criteo, Google Ads, Taboola, Google Marketing Platform (formerly DoubleClick), AdRoll, The Trade Desk, Meta for Business (formerly Facebook for Business), Outbrain, Criteo Retail Media, Basis, Yoast Wordpress SEO Plugins, ,,,,,,,
310, mobilecause, AddShoppers Social Login, eAssistance Pro (discontinued), Dell Endpoint Security Suite Enterprise, Crowdbooster (discontinued), OpenText Portal, Ayasdi Core, BookSteam, WellCycle InVision, LessAccounting, Infor CloudSuite Distribution, ,,,,,,,
311, freightquote, Descartes Logistics Technology Platform, Oracle Transportation Management Cloud, Trimble Fleet Mobility (formerly PeopleNet), FourKites, Flexport, AFS Transportation Management, BlueJay GTN, BluJay Transportation Management, Bridge LCS, ,,,,,,,,
312, vidyard, Vimeo, Loom, BombBomb, Wistia, Soapbox, Hippo Video, Camtasia, Flipgrid, Brightcove Video, Dubb - Video Communication Platform, ,,,,,,,
313, crm, AddShoppers Social Login, eAssistance Pro (discontinued), Dell Endpoint Security Suite Enterprise, Crowdbooster (discontinued), OpenText Portal, Ayasdi Core, BookSteam, WellCycle InVision, LessAccounting, Infor CloudSuite Distribution, ,,,,,,,
314, condeco, Crestron Fusion, Accruent EMS Software, SpaceIQ, Envoy Visitors, Robin, iOFFICE, Tririga, Teem by iOFFICE, Skedda, OfficeSpace Software, ,,,,,,,
315, dotmailer, Mailchimp, Klaviyo, Pardot, HubSpot Marketing Hub, Salesforce Marketing Cloud Email Studio, Twilio SendGrid, Emarsys, Campaign Monitor, Adobe Marketo Engage, Campaigner, ,,,,,,,
316, costar, ALLDATA, Karmak Fusion, Fullbay, Chrome Data AutoPlanner, Protractor.NET, R.O. Writer, CCC ONE Total Repair, MAM Autowork Online, Mitchell1 Manager SE, ,,,,,,,,
317, contactually, Veeva CRM, Oracle Siebel CRM, HubSpot CRM, Salesforce, SAP CRM, Infor CRM, Pega Customer Decision Hub, Loxo Recruitment Platform, Asana, Pipedrive, ,,,,,,,
318, aspect, Verint Workforce Engagement (discontinued), NICE CXone (formerly NICE inContact), Genesys Multicloud CX (formerly Genesys Engage), Calabrio ONE, Microsoft Dynamics 365, Calabrio Teleopti WFM, Cisco Unified Contact Center, APS Payroll, Verint Enterprise Experience (formerly Verint Enterprise Feedback Management), Salesforce Field Service (Click Field Service Edge), ,,,,,,,
319, calltrackingmetrics, Cisco Unified Contact Center, Invoca, Twilio, Call Box, Genesys Cloud CX (formerly Genesys Cloud), CallSource, PhoneBurner, CallRail, Talkdesk, Cisco Finesse, ,,,,,,,
320, gorgias, AddShoppers Social Login, eAssistance Pro (discontinued), Dell Endpoint Security Suite Enterprise, Crowdbooster (discontinued), OpenText Portal, Ayasdi Core, BookSteam, WellCycle InVision, LessAccounting, Infor CloudSuite Distribution, ,,,,,,,
321, brightedge, Semrush, Conductor, Siteimprove, Ahrefs, Yoast Wordpress SEO Plugins, Moz Pro, Google Search Console, Searchmetrics, Screaming Frog, seoClarity, ,,,,,,,
322, logstash, Apache Kafka, Apache Spark, Graylog, SolarWinds Kiwi Syslog Server, Talend Data Integration, Zabbix, Microsoft Power BI, SentinelOne, Datadog, Dynatrace, ,,,,,,,
323, simpletexting, ClickSend, Zipwhip, EZ Texting, Twilio, Podium, Avochato, Text In Church, Attentive, Trumpia, Hustle, ,,,,,,,
324, thoughtspot, Microsoft Power BI, Tableau Desktop, Looker, Amazon QuickSight, Domo, Qlik Sense, Sigma, Tableau Server, Tableau CRM (formerly Einstein Analytics), IBM Cognos Analytics with Watson, ,,,,,,,
325, exponea, Klaviyo, Twilio Segment, Braze, Iterable, Microsoft Dynamics 365, Tealium iQ, Adobe Experience Manager, Algolia, Salesforce Marketing Cloud Interaction Studio (formerly Evergage + MyBuys), SAP Commerce Cloud, ,,,,,,,
326, highspot, Seismic, Showpad Content, SharePoint, Salesforce, Bigtincan, Paperflite, Qvidian RFP & Proposal Automation, Guru, MindTickle, Uberflip, ,,,,,,,
327, bluejeans, Zoom, Microsoft Teams, Webex Meetings, Google Meet, GoTo Meeting, Webex Webinars (formerly Webex Events), GoTo Webinar, Skype for Business (formerly Lync), now part of Microsoft Teams, Adobe Connect, Blackboard Collaborate, ,,,,,,
328, snappy, Lob, Postal.io, Alyce, Sendoso, Reachdesk, Amazingmail, PFL Hybrid Experience Platform, SwagUp, Notifii Track, ,,,,,,,,
329, clio, MyCase, PracticePanther, Rocket Matter, Thomson Reuters ProLaw, Amicus Attorney, SurePoint Legal Management System (LMS), Intapp Time, Actionstep, Thomson Reuters Elite 3E Enterprise Business Management, CosmoLex, ,,,,,,,
330, accenture, CDW, Ingram Micro, IBM Garage, Elinext Healthcare Software Development, OneSource Virtual, CIENCE, Softchoice, Deloitte Consulting, Taegis ManagedXDR, AHEAD, formerly Sovereign Systems + Data Blue, ,,,,,,
331, aircall, Zoom Phone, Zendesk Talk, JustCall, CloudTalk, Google Voice, CloudCall, NICE CXone (formerly NICE inContact), Skype for Business (formerly Lync), now part of Microsoft Teams, Vonage Contact Center for Salesforce (formerly NewVoiceMedia), Ring.io, ,,,,,,
332, manychat, MobileMonkey, Tidio, Twilio, Landbot, Zendesk Support Suite, Intercom, Freshdesk Messaging (Formerly Freshchat), Hootsuite, Chatfuel, Drift, ,,,,,,,
333, soapui, Parasoft SOAtest, JMeter, IBM Rational Performance Tester, GitLab, Selenium, Tricentis NeoLoad (formerly Neotys NeoLoad), Experitest, Tricentis Tosca, BlazeMeter Continuous Testing Platform, Protractor, ,,,,,,,
334, censhare, SAP Commerce Cloud, WordPress, Salesforce CMS, Drupal, Wix, Joomla, Squarespace, Adobe Experience Manager, Sitecore Experience Manager, Magnolia, ,,,,,,,
335, cloudbees, JRebel, CloudBees Codeship, Gradle, Jenkins, Bamboo, Apache Maven, TeamCity, CircleCI, Travis CI, AWS CodeBuild, ,,,,,,,
336, postscript, EZ Texting, Hustle, Braze, SimpleTexting, CleverTap, Attentive, 360dialog WhatsApp Business API, Zipwhip, Leanplum, Localytics, ,,,,,,,
337, go, Canva, Google Ad Manager, Google Marketing Platform (formerly DoubleClick), AdRoll, Marketing Solutions by Criteo, Adobe Advertising Cloud, LinkedIn Lead Accelerator (Discontinued), AppNexus, OpenX, Skai (formerly Kenshoo), ,,,,,,,
338, tidio, ManyChat, Landbot, tawk.to, 3CX, MobileMonkey, Chatfuel, ChatBot, Zendesk Chat, IBM Watson Assistant, JivoChat, ,,,,,,,
339, dealertrack, CDK Drive, vAuto Provision, Dealer.com, ERA-IGNITE, VinSolutions, CDK Elead, IDMS by DealerSocket, vAuto Conquest, Auto/Mate by DealerSocket, ,,,,,,,,
340, pagerduty, xMatters, Datadog, OpsGenie, Splunk On-Call, formerly VictorOps, Amazon SNS, ServiceNow IT Operations Management, Nagios Core, Everbridge Mass Notification, Dynatrace, Zabbix, ,,,,,,
341, jmp, IBM SPSS, Power BI For Office 365 (discontinued), TIBCO Spotfire, Anaconda, RStudio, Tableau Desktop, MATLAB, KNIME Analytics Platform, Alteryx, TIBCO Data Science (including Team Studio and Statistica), ,,,,,,,
342, triblio, 6sense, Demandbase, Terminus ABM Platform, RollWorks, Leadfeeder, ABM Essentials, powered by Marketo Engage, Bombora, KickFire, Metadata.io, ZoomInfo, ,,,,,,
343, zenoti, MINDBODY, WellnessLiving, TeamSnap, TeamUp, Omnify, Shortcuts, Arbox, ClubHouse Online, Daxko Spectrum, ,,,,,,,,
344, seismic, Highspot, Salesforce, Showpad Content, Adobe Marketo Engage, Guru, Brainshark, Bigtincan, Bloomfire, SharePoint, MindTickle, ,,,,,,,
345, livechat, Zendesk Chat, Intercom, Drift, LiveAgent, Gist, Azure Bot Service (Microsoft Bot Framework), Qualified, Freshdesk, Freshdesk Messaging (Formerly Freshchat), LivePerson Conversation Cloud (LiveEngage), ,,,,,,,
346, xant, Bioclinica ICL, FingerCheck, Oracle Entitlements Server, AdaptX, CalciMedica, G-Node (German Informatics Node), LORIS, OpenElectrophy, Oracle Clinical One, Q-Centrix, ,,,,,,,
347, equalweb, accessiBe, Crownpeak DQM, Monsido, Silktide, Sitemorse, AudioEye, Compliance Sheriff, from AppGate, DubBot, Equally AI, ,,,,,,,
348, aventri, Cvent Event Management, Ungerboeck Software, ON24, Bizzabo, Eventbrite, Hopin, Event Espresso, SignUpGenius, Zoom, Whova, ,,,,,,,
349, alertmedia, Everbridge Mass Notification, OnSolve Critical Event Management & Mass Notification, xMatters, RedFlag, Splunk IT Service Intelligence (ITSI), SnapComms, Slack, DX Spectrum (formerly CA Spectrum), Titan HST, ,,,,,,,,
350, shippo, ShipStation, Narvar, Pirate Ship, Easyship, ShippingEasy, Dropex, ShipperHQ, Happy Returns, AfterShip, Deliverr, EFI SmartLinc Shipping, ,,,,,,
351, scala, Drools, BrightSign, Four Winds Interactive, Rise Vision, Apache Spark, TelemetryTV, Red Hat Decision Manager, ScreenCloud Signage, Chrome Sign Builder, ,,,,,,,,
352, smartdeploy, PDQ Deploy, Microsoft Endpoint Manager (Microsoft Intune + SCCM), Ivanti Patch, KACE Asset Management Appliance, EMCO MSI Package Builder, ManageEngine Desktop Central, Faronics Core, Symantec Ghost Solution Suite, KACE Systems Deployment Appliance (SDA), Tanium, ,,,,,,,
353, taboola, Outbrain, AdRoll, Google Ads, Marketing Solutions by Criteo, Yahoo Gemini! (Verizon Media Native), formerly Yahoo! Advertising, Nativo, Revcontent, Amazon Advertising Sponsored Products, StackAdapt, AdSense, ,,,,,,
354, buildinglink, Dotloop, Yardi Voyager, Sage 300 Construction and Real Estate, AppFolio Property Manager, Condo Control, MRI Residential Management, Brokermint, CoStar Real Estate Manager, Buildium, ,,,,,,,,
355, catia, Rhino 3D, Autodesk Inventor, PTC Creo, Autodesk Fusion 360, Siemens NX CAD, Solid Edge, Onshape, Enovia, AutoCAD, Grasshopper, ,,,,,,,
356, worldpay, Stripe, Adyen, Fiserv (First Data) - ICICI Merchant Services, TSYS Payment Gateway, TransferWise, Braintree, a PayPal service, CyberSource, PayPal Payments Pro, Sage Pay, Authorize.Net, ,,,,,,
357, plansource, bswift, UKG Pro, Zenefits, Maxwell Health, Rippling, Benefitfocus, Employee Navigator, Sage HRMS, Ceridian Dayforce HCM, isolved, ,,,,,,,
358, outbrain, Taboola, Google Ads, Nativo, Revcontent, AdRoll, Yahoo Gemini! (Verizon Media Native), formerly Yahoo! Advertising, Marketing Solutions by Criteo, Outgrow, StackAdapt, Verizon Media Ad Platform, formerly Oath (Brightroll, One by AOL, Yahoo Gemini), ,,,
359, fastly, Akamai, Amazon CloudFront, NGINX, Azure CDN, Google Cloud CDN, Cloudflare, Imperva CDN, Limelight Content Delivery, Pantheon, IBM Cloud Internet Services, ,,,,,,,
360, pixlee, Botify, Ion, by Rock Content, PathFactory, Outgrow, Sprinklr Modern Marketing & Advertising, Percolate, Oracle Content Marketing (Compendium), legacy, Upland Kapost, Contently, SnapApp, ,,,,,
361, olo, Grubhub for Restaurants, Dishop Fleet, GloriaFood Online Ordering & Table Reservation System an Oracle Company, BellyMelly, Bite Squad, BlueCart, ChowNow, Cuboh, Cygneto Apps For Ordering, ,,,,,,,,
362, murex, AddShoppers Social Login, eAssistance Pro (discontinued), Dell Endpoint Security Suite Enterprise, Crowdbooster (discontinued), OpenText Portal, Ayasdi Core, BookSteam, WellCycle InVision, LessAccounting, Infor CloudSuite Distribution, ,,,,,,,
363, dialogtech, CallRail, Marchex, Invoca, CallSource, Call Box, Freshdesk Contact Center (Formerly Freshcaller), NICE Engage Platform, CallTrackingMetrics, Analytic Call Tracking, Exotel, Convirza, LeadsPedia, ,,,,,
364, xamarin, Appium, Android Studio, BrowserStack, Laravel PHP Framework, Mendix, NativeScript, Temenos Quantum (formerly Kony), IntelliJ IDEA, Contentful, AWS IoT Core, ,,,,,,,
365, sugarcrm, Anypoint Platform, Salesforce, HubSpot CRM, Zoho CRM, monday.com, Microsoft Dynamics 365, Oracle Siebel CRM, Oracle CRM, Odoo, Jira Software, ,,,,,,,
366, ascentis, UKG Ready, UKG Pro, ADP Workforce Now, TribeHR (discontinued), Paychex Flex, UKG Dimensions, Zoho CRM, Paylocity, Paycom, Oracle PeopleSoft HCM, ,,,,,,,
367, classy, GoFundMe Charity (formerly CrowdRise), Qgiv, Salesforce.org Nonprofit Cloud, Bloomerang, Blackbaud Raiser's Edge NXT, Kindful, a Bloomerang product, OneCause, Blackbaud CRM, DonorPerfect, GiveSmart, ,,,,,,
368, hirevue, HireRight, Modern Hire, Spark Hire, VidCruiter, SAP SuccessFactors, iCIMS, SplashLearn, Jobvite, Oracle Cloud HCM, Avature ATS, ,,,,,,,
369, commercetools, Adobe Commerce (Magento Commerce), SAP Commerce Cloud, Salesforce Commerce Cloud, Spryker Cloud Commerce OS, Mirakl Marketplace Platform, Shopify Plus, BigCommerce, Elastic Path, Magento Open Source, Oracle CX Commerce (formerly Oracle Commerce Cloud), ,,,,,,,
370, expensify, Bill.com, QuickBooks Self-Employed, Dext Prepare (with Receipt Bank), QuickBooks Online, Concur Travel and Expense, Brex, Hubdoc, Neat, Divvy, TripActions, ,,,,,,,
371, actifio, Veeam Backup & Replication, Denodo, Delphix, AWS Backup, Commvault Complete Data Protection, Rubrik, Veeam Backup for Microsoft Office 365, Veritas NetBackup, Cohesity Helios, HYCU Backup & Recovery for Nutanix, ,,,,,,,
372, plangrid, Procore, Bluebeam Revu, Fieldwire, On-Screen Takeoff, Autodesk Bim 360, PlanSwift, by ConstructConnect, Newforma Project Center, Buildertrend, Sage Estimating, Smartsheet, ,,,,,,
373, postman, SwaggerHub, ReadyAPI, JMeter, PortSwigger Burp Suite, Selenium, Visual Studio IDE, PyCharm, Katalon Studio, Azure API Management, Amazon API Gateway, ,,,,,,,
374, basecamp, Microsoft Teams, Salesforce, ClickUp, monday.com, Jira Software, HubSpot CRM, Moodle, Google Workspace (formerly G Suite), Microsoft To Do (formerly Wunderlist), Discord, ,,,,,,,
375, unily, Staffbase, Firstup, SharePoint, Medallia, Workplace from Meta, Qualtrics, Concrete CMS, Interact Software, 15Five, Discord, ,,,,,,,
376, pointclickcare, MatrixCare, Epic, Meditech Electronic Health Records, NextGen Healthcare EHR, eClinicalWorks, Allscripts Professional EHR, Cerner Practice Management (PowerWorks), Yardi Senior Living, Brightree, Kareo Practice Management, ,,,,,,,
377, jaggaer, SAP Ariba Contract Management, Coupa, SAP Ariba Procurement, GEP SMART, Oracle Cloud ERP, Oracle PeopleSoft SCM, Microsoft Dynamics 365, Salesforce, Zip Intake-to-Procure, Emptoris, ,,,,,,,
378, skilljar, Articulate 360, Thinkific, Docebo Learning Suite, LinkedIn Learning (Lynda.com), Degreed, LearnUpon, Lessonly, Tovuti LMS, Cornerstone OnDemand, SAP Litmos, ,,,,,,,
379, sentry, Firebase Crashlytics, New Relic, Datadog, Prometheus, Amazon CloudWatch, Bugsnag, Graylog, Chrome DevTools, Logz.io, Instabug, ,,,,,,,
380, accertify, Kount, Oracle Adaptive Access Manager, NICE Actimize, ClickGUARD, Signifyd Commerce Protection Platform, SEON. Fraud Fighters, CGI HotScan360, Riskified, Sift Digital Trust & Safety Suite, ,,,,,,,,
381, daptiv, Jira Software, Planview Enterprise One, Azure DevOps Services, Microsoft Project, Planview Changepoint, WorkOtter PPM, Microsoft Project Server, Planview PPM Pro, Smartsheet, Planisware, ,,,,,,,
382, tatango, Flurry Analytics, CallFire, EZ Texting, Braze, SimpleTexting, CleverTap, Attentive, 360dialog WhatsApp Business API, Zipwhip, Leanplum, Localytics, ,,,,,,
383, domo, Microsoft Power BI, Datorama, ThoughtSpot, Sisense, Looker, Qlik Sense, Google Data Studio, Amazon QuickSight, SAP BusinessObjects Business Intelligence (BI) Platform, Anaplan, ,,,,,,,
384, shiphero, ShippingEasy, ShipStation, Pirate Ship, Narvar, Shippo, Happy Returns, AfterShip, Deliverr, Dropex, ,,,,,,,,
385, hcss, B2W Estimate, Procore, Vista by Viewpoint, Bluebeam Revu, Sage Estimating, InEight, PlanGrid, Raken, On-Screen Takeoff, PlanSwift, by ConstructConnect, ,,,,,,
386, jive-x, Khoros Communities (Formerly Spredfast + Lithium), Verint Community (Telligent), Confluence, OpenText Documentum, Social Mention, Khoros Care (Formerly Spredfast + Lithium), Centercode, Salesforce Experience Cloud (formerly Salesforce Community Cloud), Vanilla Forums, Tribe Community Platform, ,,,,,,,
387, relativity, DISCO Ediscovery, Nuix Discover (formerly Ringtail), Eclipse, Logikcull, discovery ][ Local, IBM StoredIQ Suite, Nextpoint, Digital WarRoom, eDiscovery Point (discontinued), Everlaw, AccessData Summation, from Exterro, ,,,,,
388, wordpress, ASP.NET, React, Adobe Experience Manager, CodeIgniter, Moodle, Canva, Salesforce, SharePoint, Laravel PHP Framework, Oracle APEX, ,,,,,,,
389, skillsoft, LinkedIn Learning (Lynda.com), Coursera, Skillsoft Percipio (Skillport), Degreed, BizLibrary, Udemy for Business, Pluralsight Skills, UKG Ready, Centrical, Adobe Captivate, ,,,,,,,
