518, shl, AddShoppers Social Login, eAssistance Pro (discontinued), Dell Endpoint Security Suite Enterprise, Crowdbooster (discontinued), OpenText Portal, Ayasdi Core, BookSteam, WellCycle InVision, LessAccounting, Infor CloudSuite Distribution, ,,,,,,,
519, pymetrics, AddShoppers Social Login, eAssistance Pro (discontinued), Dell Endpoint Security Suite Enterprise, Crowdbooster (discontinued), OpenText Portal, Ayasdi Core, BookSteam, WellCycle InVision, LessAccounting, Infor CloudSuite Distribution, ,,,,,,,
520, bloomerang, DonorPerfect, Salesforce.org Nonprofit Cloud, Blackbaud Raiser's Edge NXT, Network for Good, Kindful, a Bloomerang product, Little Green Light, Neon CRM, Blackbaud eTapestry, Classy, Raiser's Edge, ,,,,,,
521, divvycloud, Palo Alto Networks Prisma Cloud, Lacework, Forcepoint Web Security, Armor, AWS CloudTrail, Trend Micro Cloud One - Workload Security (formerly Deep Security), Cisco TrustSec, F-Secure Cloud Protection for Salesforce, Check Point CloudGuard Posture Management (formerly Dome9), Apigee Sense, ,,,,,,,
522, loopio, RFPIO, Qvidian RFP & Proposal Automation, Qwilr, RFP360, from RFPIO, VisibleThread Docs, PandaDoc, PMAPS, Asana, ConnectWise Sell, Proposify, ,,,,,,
523, eaglesoft, Dentrix, Open Dental Software, CS PracticeWorks Software, Solutionreach, Cloud 9 Software, CS SoftDent Software, Lighthouse 360, ExcelDent, Dolphin ImagingPlus, EXACT Dental Practice Management, ,,,,,,,
524, rybbon, Zinrelo, Tango Card, Medallia, Clover, Xoxoday Plum, Rakuten Rewards (formerly Ebates), Antavo, Como, Giftbit, Kangaroo Rewards, ,,,,,,,
525, mycoi, AddShoppers Social Login, eAssistance Pro (discontinued), Dell Endpoint Security Suite Enterprise, Crowdbooster (discontinued), OpenText Portal, Ayasdi Core, BookSteam, WellCycle InVision, LessAccounting, Infor CloudSuite Distribution, ,,,,,,,
526, wrike, Azure DevOps Services, Microsoft Project, monday.com, Asana, Oracle Primavera, Adobe Workfront, ClickUp, Smartsheet, Salesforce, Atlassian Jira Align (formerly AgileCraft), ,,,,,,,
527, mobileiron, Microsoft Endpoint Manager (Microsoft Intune + SCCM), Workspace ONE Unified Endpoint Management (UEM, Jamf Pro, Blackberry UEM, SOTI MobiControl, Lookout, Sophos Mobile, IBM Security MaaS360 with Watson, CrowdStrike Falcon, Citrix Endpoint Management, ,,,,,,,
528, localytics, Adobe Analytics, Firebase, Braze, Google Analytics, Firebase Crashlytics, Matomo Analytics (formerly Piwik), AppsFlyer, Apptopia, App Annie, Adjust Attribution, ,,,,,,,
529, rkt, Amazon Elastic Container Service (Amazon ECS), Red Hat OpenShift, Azure Kubernetes Service (AKS), Docker, Google Kubernetes Engine, Mesos, Nomad, Mirantis Kubernetes Engine (Docker Enterprise), Amazon CloudWatch, GitLab, ,,,,,,,
530, groove, Outreach, Salesloft, Sendoso, HubSpot Sales Hub, High Velocity Sales, Adobe Marketo Engage, Cirrus Insight, Yesware, Salesforce Inbox, Mixmax, ,,,,,,,
531, tradegecko, QuickBooks Online, Odoo, DEAR Systems, by Cin7, Cin7, Webgility, Vend, inFlow Inventory, QuickBooks Desktop Enterprise, Brightpearl, NetSuite ERP, ,,,,,,
532, workramp, Docebo Learning Suite, GradPoint, Google Classroom, Canvas, Moodle, Blackboard Learn, Schoology Learning, Brightspace, Edmodo, Sakai, WizIQ LMS, ,,,,,,
533, avidxchange, Bill.com, Tipalti, NexusPayables, Concur Travel and Expense, MineralTree, Coupa, Beanworks, by Quadient, Billtrust, Emburse Certify, Nvoicepay, ,,,,,,
534, clari, Salesforce, Tableau CRM (formerly Einstein Analytics), Gong, InsightSquared Sales Analytics, People.ai, Anaplan, Tableau Desktop, Microsoft Power BI, 6sense, Aviso Insights, ,,,,,,,
535, blackline, FloQast, Oracle Cloud EPM, SAP ERP, SAP BPC (Business Planning and Consolidation), Oracle Hyperion, Microsoft Dynamics 365, OneStream, ReconNET, Vena, Salesforce, ,,,,,,,
536, code42, Backblaze Business Backup, OneDrive, Veeam Backup & Replication, Amazon S3, IDrive, Carbonite Server, Druva Data Resiliency Cloud (fomerly Druva inSync, Phoenix & CloudRanger), Acronis Cyber Backup, Carbonite Endpoint, Datto SIRIS, ,,,,,,
537, pandadoc, DocuSign, Adobe Acrobat Sign, Proposify, Qwilr, Conga Document Generation, HelloSign, Salesforce CPQ, HotDocs, SignRequest, SignNow, ,,,,,,,
538, clickfunnels, Keap, Landingi, Salesforce, unbounce, AWeber, ActiveCampaign, Instapage, Wishpond, Outgrow, ConvertKit, ,,,,,,,
539, bookeo, SetMore, Doodle, Calendly, Acuity Scheduling, a Squarespace company, Chili Piper, Booker, ScheduleOnce, YouCanBook.Me, 10to8 Appointment Scheduling Software, Engageware (formerly TimeTrade), ,,,,,,
540, purecloud, Genesys Multicloud CX (formerly Genesys Engage), Genesys PureConnect, NICE CXone (formerly NICE inContact), Amazon Connect, Cisco Unified Contact Center, Talkdesk, Avaya OneCloud CCaaS, RingCentral MVP, Microsoft Teams, Twilio, ,,,,,,,
541, jobvite, iCIMS, Greenhouse, SmartRecruiters, JazzHR, Breezy HR, Workable, Workday HCM, Lever, HireVue, Oracle Cloud HCM, ,,,,,,,
542, crayon, Klue, Meltwater Media Intelligence Platform, NetBase Quid, Claritas PRIZM Premier, ZoomInfo, S&P Capital IQ, Gazelle.ai, SimilarWeb PRO, AMI Enterprise Intelligence, Datorama, Oracle DaaS, Comscore Ad Metrix, Cronycle, Adgooroo, from Adthena (formerly from Kantar), AdClarity, Nielsen Digital Ads Ratings, 
543, temenos, Oracle FLEXCUBE, CGI Open Finance, Mambu, Fusion Treasury, Validis, SAP for Banking, TCS BaNCS, Premier Bank Platform, Avaloq Banking Suite, Plaid, Fiserv Precision, PROFITS, ,,,,,
544, datastax, Cassandra, MongoDB, Neo4j, Databricks Lakehouse Platform, Couchbase, SingleStore (formerly MemSQL), Cloudera Enterprise Data Hub, Oracle NoSQL Database, CouchDB, Cloudera Manager, ,,,,,,,
545, checkfront, Rezdy, Calendly, Acuity Scheduling, a Squarespace company, Doodle, Chili Piper, Booker, ScheduleOnce, YouCanBook.Me, 10to8 Appointment Scheduling Software, Engageware (formerly TimeTrade), ,,,,,,
546, dacast, JW Player, Datazoom, Adobe Primetime, Akamai Adaptive Media Delivery, THUNDERSTORM, Enveu, Muvi, Wowza Streaming Cloud, Accedo One, ApsaraVideo Live, ,,,,,,,
547, thousandeyes, Nexthink, SolarWinds NPM, LiveAction LiveNX, AppDynamics, NETSCOUT nGeniusONE, Datadog, Cisco Meraki Insight, Dynatrace, AppNeta, Catchpoint, ,,,,,,,
548, workfront, Jira Software, Azure DevOps Services, Asana, Salesforce, Aprimo, ServiceNow IT Service Management, Appian, Adobe Experience Manager, Wrike, monday.com, ,,,,,,,
549, mparticle, Twilio Segment, Microsoft Dynamics 365 Marketing, Salesforce Marketing Cloud Interaction Studio (formerly Evergage + MyBuys), BlueConic, Tealium AudienceStream, Blueshift, Lytics, Treasure Data, SAP Customer Data Solutions (formerly Gigya), Leadspace, Reachforce SmartSuite (Now Leadspace), Optimizely Data Platform (formerly Zaius), ,,,,,
550, chatbot, AddShoppers Social Login, eAssistance Pro (discontinued), Dell Endpoint Security Suite Enterprise, Crowdbooster (discontinued), OpenText Portal, Ayasdi Core, BookSteam, WellCycle InVision, LessAccounting, Infor CloudSuite Distribution, ,,,,,,,
551, birst, IBM Cognos Analytics with Watson, Microsoft Power BI, Tableau Desktop, Snowflake, MicroStrategy Analytics, Amazon QuickSight, SAP Crystal, SAP BusinessObjects Business Intelligence (BI) Platform, Qlik Sense, Microsoft BI (MSBI), ,,,,,,,
552, aptify, StarChapter, iMIS Engagement Management System, NetForum by Community Brands, Daxko Operations, Personify360, 123 Signup Association Manager, MemberClicks, Nimble AMS by Community Brands, YourMembership by Community Brands, netFORUM Pro, ,,,,,,,
553, sailthru, Salesforce, Salesforce Marketing Cloud Email Studio, Iterable, Klaviyo, Mailchimp, Emma, Customer.io, Pardot, Emarsys, Campaign Monitor, ,,,,,,,
554, everyonesocial, GaggleAMP, Sociabble, Firstup, Sprinklr Social Engagement & Sales, Hootsuite, Sprout Social, LinkedIn Elevate, Oktopost, Salesforce Social Studio, Bambu by Sprout Social, ,,,,,,,
555, crashplan, Backblaze Business Backup, OneDrive, Veeam Backup & Replication, Amazon S3, IDrive, Carbonite Server, Druva Data Resiliency Cloud (fomerly Druva inSync, Phoenix & CloudRanger), Acronis Cyber Backup, Carbonite Endpoint, Datto SIRIS, ,,,,,,
556, nuxeo, Alfresco Content Services, IBM FileNet, OnBase by Hyland, OpenText Content Suite Platform, SharePoint, OpenText Documentum, Cloudinary, Laserfiche, Document360, Aprimo, ,,,,,,,
557, formstack, FormAssembly, Microsoft Power Automate, Google Forms, Qualtrics, Jotform, PowerApps, SurveyMonkey, DocuSign, Typeform, Adobe Acrobat Sign, ,,,,,,,
558, clearbit, ZoomInfo, 6sense, Leadfeeder, Metadata.io, Demandbase, Lusha Extension, Crunchbase, LinkedIn Sales Navigator, Hunter, D&B Optimizer, ,,,,,,,
559, alienvault, Splunk Enterprise, Darktrace, Microsoft Sentinel (formerly Azure Sentinel), LogRhythm NextGen SIEM Platform, CrowdStrike Falcon, IBM Security QRadar, SolarWinds Security Event Manager (SEM), AlienVault OSSIM, Zabbix, SentinelOne, ,,,,,,,
560, tapjoy, Vungle, Adstream, Apple iAd, AdCheck - URL Tracking Link Verification, Basis, AppLovin, Chartboost, MoPub, Google AdMob, AdColony, from Digital Turbine, ironSource, ,,,,,
561, leveleleven, Ambition, Hoopla, Zoho Motivator, Microsoft Dynamics 365 - Gamification (FantasySalesTeam), deprecated, Centrical, Bunchball Nitro, Kahoot!, Brainshark, Revenue.io (formerly RingDNA), Qstream, ,,,,,,
562, liveengage, Twilio, IBM Watson Assistant, LiveAgent, Glia (formerly Salemove), Salesforce Service Cloud, Genesys Multicloud CX (formerly Genesys Engage), Khoros Care (Formerly Spredfast + Lithium), Intercom, SAP Conversational AI, Drift, ,,,,,,,
563, zabbix, Prometheus, Nagios Core, Elasticsearch, Graylog, Observium, Splunk Enterprise, OpenNMS, SolarWinds NPM, InfluxDB, Microsoft System Center Operations Manager (SCOM), ,,,,,,,
564, dialpad, Zoom Phone, Google Voice, Microsoft Teams, Nextiva Business Phone Service, Gong, Grasshopper, Zendesk Talk, Ooma Office, 8x8 X Series, Talkdesk, ,,,,,,,
565, donorsnap, Little Green Light, DonorPerfect, Neon CRM, Salesforce.org Nonprofit Cloud, Blackbaud eTapestry, Bloomerang, GoFundMe Charity (formerly CrowdRise), GiveSmart, OneCause, DonorScape, ,,,,,,,
566, knowledgehound, Bloomfire, Zendesk Guide, Guru, Stack Overflow for Teams, Slite, Tettra, Zoho Wiki, PolicyTech, Answerbase, ,,,,,,,,
567, livewebinar, Zoom, BigMarker, WebinarJam, Microsoft Teams, GoTo Webinar, EverWebinar, Zoom Video Webinar, Jitsi, Adobe Connect, 3CX, ,,,,,,,
568, endicia, AddShoppers Social Login, eAssistance Pro (discontinued), Dell Endpoint Security Suite Enterprise, Crowdbooster (discontinued), OpenText Portal, Ayasdi Core, BookSteam, WellCycle InVision, LessAccounting, Infor CloudSuite Distribution, ,,,,,,,
569, admob, AppLovin, ironSource, MoPub, Smaato, Vungle, Apple iAd, AppsFlyer, Autopilot, Twitter Ads, Google Analytics, ,,,,,,,
570, securepay, PayPal Payments Pro, Stripe, Google Pay, Authorize.Net, Amazon Pay, Apple Pay, Paytm, Payoneer, TransferWise, ,,,,,,,,
571, givesmart, OneCause, Blackbaud Raiser's Edge NXT, Classy, Qtego, Bloomerang, Greater Giving, Flipcause, FrontStream Panorama, Salsa Engage, CrowdCompass, ,,,,,,,
572, etix, SignUpGenius, Socio, Eventleaf Online, RegOnline by Cvent (Discontinued), Bizzabo, eMeetingsOnline, ACTIVE Camp, Regpack, Azur Systems, Picatic, ,,,,,,,
573, opentable, AddShoppers Social Login, eAssistance Pro (discontinued), Dell Endpoint Security Suite Enterprise, Crowdbooster (discontinued), OpenText Portal, Ayasdi Core, BookSteam, WellCycle InVision, LessAccounting, Infor CloudSuite Distribution, ,,,,,,,
574, qstream, Brainshark, Cornerstone OnDemand, Axonify, Lessonly, Highspot, SAP SuccessFactors, MindTickle, worxogo Nudge Coach, Bloomfire, Trakstar Learn (formerly Mindflash), ,,,,,,,
575, clover, PayPal Zettle, Toast Point of Sale, Lightspeed Retail, Verifone Point, Aldelo POS, Shopify, TSYS Payment Gateway, TouchBistro, ShopKeep, Tango Card, ,,,,,,,
576, socialchorus, EveryoneSocial, Slack, Staffbase, SnapComms, Hootsuite Amplify, Bambu by Sprout Social, GaggleAMP, Workplace from Meta, LinkedIn Elevate, Sociabble, ,,,,,,,
577, inmoment, Qualtrics, Medallia, AskNicely, SurveyMonkey, Microsoft Dynamics 365 Customer Service, ProProfs Quiz Maker, Genesys PureConnect, Confirmit, MaritzCX, Gainsight Customer Cloud, ,,,,,,,
578, catchpoint, ThousandEyes, New Relic, AppDynamics, Dynatrace, Apica Synthetic, Amazon CloudWatch, Site24x7 All-in-One Monitoring, Nexthink, AlertSite, Datadog, ,,,,,,,
579, report2web, Control-M, SharePoint, PowerDMS, IBM FileNet, OnBase by Hyland, XaitPorter, ABBYY FineReader, Fiserv Director, OpenText Intelligent Capture (formerly OpenText Captiva), ,,,,,,,,
580, foresee, Medallia, Hotjar, Wufoo, Verint Digital Experience ( formerly OpinionLab), SoGoSurvey, Typeform, Predictive Index Behavioral Assessment, FluidSurveys (Discontinued), Alida CXM (formerly Vision Critical), Verint Enterprise Experience (formerly Verint Enterprise Feedback Management), ,,,,,,,
581, servicetitan, Salesforce, Sage CRM, Thryv, Microsoft Dynamics 365, HouseCall Pro, WorkMarket, an ADP Company, HubSpot CRM, Zoho CRM, Jobber, SAP CRM, ,,,,,,
582, extrahop, Darktrace, NETSCOUT nGeniusONE, Cisco Secure Network Analytics (Stealthwatch), LiveAction LiveNX, Splunk Enterprise, IBM Security QRadar, Wireshark, Datadog, Elasticsearch, TrueSight Capacity Optimization, ,,,,,,,
583, truckmate, Oracle Transportation Management Cloud, Descartes Logistics Technology Platform, Trimble Fleet Mobility (formerly PeopleNet), FourKites, Flexport, AFS Transportation Management, BlueJay GTN, BluJay Transportation Management, Bridge LCS, ,,,,,,,,
584, yourmembership, MemberClicks, NetForum by Community Brands, iMIS Engagement Management System, Neon CRM, Higher Logic Community, Daxko Operations, Personify360, 123 Signup Association Manager, Nimble AMS by Community Brands, netFORUM Pro, Billhighway, ,,,,,,
585, remarkety, Klaviyo, Emarsys, Omnisend, Google Marketing Platform (formerly DoubleClick), Skai (formerly Kenshoo), Verizon Media Ad Platform, formerly Oath (Brightroll, One by AOL, Yahoo Gemini), Marketing Solutions by Criteo, Google Ad Manager, AdRoll, Adobe Advertising Cloud, LinkedIn Lead Accelerator (Discontinued), AppNexus, OpenX, ,
586, cobalt, Tachyon, Cofense Triage, KnowBe4 PhishER, Proofpoint Threat Response Auto-Pull, VMware Carbon Black EDR, BlackBerry Optics (CylanceOPTICS), Barracuda Forensics and Incident Response, Cherwell Information Security Management Solution (ISMS), Proofpoint Threat Response, ,,,,,,,,
587, achievers, Workhuman (formerly Globoforce), BetterWorks, Predictive Index Behavioral Assessment, Culture Amp, Kudos®, Kazoo, Workday HCM, SAP SuccessFactors, Saba TalentSpace (formerly Halogen), Quantum Workplace Performance Management Platform, ,,,,,,,
588, appnexus, Google Marketing Platform (formerly DoubleClick), The Trade Desk, Google Ad Manager, Google Ads, Smart AdServer, OpenX, SmartyAds DSP, Simpli.fi, Verizon Media Ad Platform, formerly Oath (Brightroll, One by AOL, Yahoo Gemini), MediaMath, ,,,,
589, loom, Vimeo, BombBomb, Vidyard, Snagit, OBS Studio, screenflow, CloudApp, Zoom, Camtasia, Wistia, ,,,,,,,
590, bravely, Wellable, Apple Health, Fitbit, Virgin Pulse, GoVida, Google Fit, Sprout, MyFitnessPal, Zoho BackToWork, ,,,,,,,,
591, agility, WordPress, Acquia Digital Experience Platform, Bitrix Site Manager, Cision Communications Cloud, Umbraco CMS, HubSpot CMS Hub, Sitecore Experience Manager, Progress Sitefinity, Quora Blogs, Kontent by Kentico, ,,,,,,,
592, celonis, UiPath Process Mining (formerly ProcessGold), Microsoft Power BI, ARIS, Tableau Desktop, Pega Platform, Microsoft Power Automate, Alteryx, SAP BPM, ARIS Process Mining, SAP Analytics Cloud, ,,,,,,,
593, swimlane, Splunk SOAR (Security Orchestration, Automation and Response), formerly Phantom, IBM Resilient Security Orchestration, Automation and Response (SOAR), Palo Alto Networks Cortex XSOAR (formerly Demisto), 5C BOSS, D3 Security, DFLabs IncMan, FireEye Security Orchestrator, NetWitness Orchestrator, Securonix SOAR, ,,,,,
594, brightsign, Scala, Four Winds Interactive, TelemetryTV, Rise Vision, ScreenCloud Signage, Robin, Accruent EMS Software, iOFFICE, Chrome Sign Builder, Condeco, ,,,,,,,
595, clevertap, Firebase, MoEngage, Braze, AppsFlyer, Google Analytics, Netcore Smartech, Mixpanel, OneSignal, Twilio Segment, Insider Growth Management Platform (GMP), ,,,,,,,
596, tripleseat, Classy, Socio, ON24, Cvent Event Management, Whova, Eventbrite, CrowdCompass, Splash Event Marketing Platform, Cvent Event Diagramming (Formerly Social Tables), Aventri (formerly etouches), ,,,,,,,
597, contentstack, Contentful, Sitecore Experience Manager, Liferay Digital Experience Platform (DXP), Drupal, Magnolia, WordPress, Joomla, Adobe Experience Manager, Wix, Squarespace, ,,,,,,,
598, discourse, Vanilla Forums, Tribe Community Platform, Microsoft Teams, Microsoft Yammer, Salesforce Experience Cloud (formerly Salesforce Community Cloud), Wix, InVision, Khoros Communities (Formerly Spredfast + Lithium), Influitive, Higher Logic Community, ,,,,,,,
599, softrax, AddShoppers Social Login, eAssistance Pro (discontinued), Dell Endpoint Security Suite Enterprise, Crowdbooster (discontinued), OpenText Portal, Ayasdi Core, BookSteam, WellCycle InVision, LessAccounting, Infor CloudSuite Distribution, ,,,,,,,
600, bartender, Asset Panda, BarCloud Stock, Dynamsoft Barcode Reader, Wasp QuickStore, Zebra DNA, Accusoft Barcode Xpress, Cognex DataMan, Cognex MX Series, Datalogic Gryphon, Datalogic Magellan, ,,,,,,,
601, fleetsmith, Microsoft Endpoint Manager (Microsoft Intune + SCCM), Jamf Pro, Hexnode UEM, Workspace ONE Unified Endpoint Management (UEM, Cisco Meraki SM, Addigy, Jamf Now, Sophos Mobile, Miradore, Rippling, ,,,,,,,
602, quorum, AddShoppers Social Login, eAssistance Pro (discontinued), Dell Endpoint Security Suite Enterprise, Crowdbooster (discontinued), OpenText Portal, Ayasdi Core, BookSteam, WellCycle InVision, LessAccounting, Infor CloudSuite Distribution, ,,,,,,,
603, threatconnect, IBM Resilient Security Orchestration, Automation and Response (SOAR), Splunk SOAR (Security Orchestration, Automation and Response), formerly Phantom, Palo Alto Networks Cortex XSOAR (formerly Demisto), 5C BOSS, D3 Security, DFLabs IncMan, FireEye Security Orchestrator, NetWitness Orchestrator, Securonix SOAR, ,,,,,
604, virtuous, Salesforce.org Nonprofit Cloud, Kindful, a Bloomerang product, Blackbaud Raiser's Edge NXT, DonorPerfect, Raiser's Edge, Network for Good, Bloomerang, Classy, NetSuite ERP, Luminate CRM and Analytics, ,,,,,,
605, schooldude, Hippo CMMS, UpKeep Maintenance Management, IBM Maximo, FAMIS 360, Maintenance Connection CMMS, Corrigo, Accruent EMS Software, ServiceChannel, Tririga, eMaint, ,,,,,,,
606, calendly, Zoho Bookings, SignUpGenius, Acuity Scheduling, a Squarespace company, Doodle, HoneyBook, Chili Piper, YouCanBook.Me, Assistant.to, x.ai, ScheduleOnce, ,,,,,,
607, securityscorecard, Recorded Future, Tenable.sc (formerly SecurityCenter), Ivanti Security Controls, Qualys Private Cloud Platform, BitSight Security Ratings, Rapid7 InsightVM (Nexpose), Tripwire Enterprise, Tenable.io, Beeline Extended Workforce Platform, Tanium, ,,,,,,,
608, learncore, Lessonly, Articulate 360, Cornerstone OnDemand, SAP Litmos, Kallidus LMS, Docebo Learning Suite, Spekit, Rise, Ceridian Dayforce HCM, LMS365, ,,,,,,,
609, bugcrowd, HackerOne, Applause, PortSwigger Burp Suite, KeepSolid VPN Unlimited, Hootsuite, Metasploit, Tanium, Zscaler Internet Access, 1Password, ,,,,,,,,
610, conductor, BrightEdge, Semrush, Ahrefs, Google Search Console, ContentKing, Google Trends, seoClarity, Siteimprove, Yoast Wordpress SEO Plugins, Moz Pro, ,,,,,,,
611, signal, PR Newswire, Help a Reporter Out (HARO), Cision PRWeb, Muck Rack, Cision Communications Cloud, Meltwater Media Intelligence Platform, Newswire, Critical Mention, Business Wire, ,,,,,,,,
612, apptio, Microsoft BI (MSBI), ServiceNow IT Service Management, Anaplan, Turbonomic, CloudCheckr, Tableau Desktop, Planview Enterprise One, Oracle Cloud Infrastructure, Workday Adaptive Planning, Alteryx, ,,,,,,,
613, bigpanda, ignio AIOps, ServiceNow IT Operations Management, Oracle Management Cloud, New Relic, Dynatrace, Moogsoft, StackState, Datadog, SolarWinds Security Event Manager (SEM), PagerDuty, ,,,,,,,
614, snapengage, Paperflite, Drift, JivoChat, LivePerson Conversation Cloud (LiveEngage), Intercom, Acquire.io, LiveChat, Gist, Genesys DX (formerly Bold360), Zendesk Chat, Freshdesk Messaging (Formerly Freshchat), Zoho SalesIQ, Olark, Smith.ai Live Website Chat, ,,,
615, unbounce, Google Optimize, Instapage, Leadpages, Wunderkind, formerly BounceX, Ceros, Adobe Target, VWO, Optimizely Web Experimentation, Landingi, Mailchimp, ,,,,,,
616, billtrust, Bill.com, Esker, Salesforce CPQ, HighRadius Autonomous Receivables, Stripe, Fiserv eBill Distribution (Biller Direct), AvidXchange, Merchant e-Solutions, Concur Invoice, Oracle Utilities Customer Care and Billing, ,,,,,,,
617, cloudcheckr, ApptioOne, Turbonomic, ServiceNow IT Service Management, Amazon CloudWatch, ParkMyCloud, CloudHealth by VMware, Oracle Cloud Infrastructure, Morpheus, OpsNow, OpsCompass, ,,,,,,,
618, zonos, AddShoppers Social Login, eAssistance Pro (discontinued), Dell Endpoint Security Suite Enterprise, Crowdbooster (discontinued), OpenText Portal, Ayasdi Core, BookSteam, WellCycle InVision, LessAccounting, Infor CloudSuite Distribution, ,,,,,,,
619, cerkl, AddShoppers Social Login, eAssistance Pro (discontinued), Dell Endpoint Security Suite Enterprise, Crowdbooster (discontinued), OpenText Portal, Ayasdi Core, BookSteam, WellCycle InVision, LessAccounting, Infor CloudSuite Distribution, ,,,,,,,
620, airtable, Microsoft Access, ClickUp, PowerApps, AppSheet, monday.com, Microsoft Power BI, Tableau Desktop, Infinity, HubSpot Marketing Hub, Appian, ,,,,,,,
621, gotoassist, TeamViewer, Microsoft Teams, Rescue, Microsoft Endpoint Manager (Microsoft Intune + SCCM), Cisco Webex Support, GoTo Meeting, GoToMyPC, Splashtop Enterprise, Zoom, Remote Desktop Services, ,,,,,,,
622, nicejob, Birdeye, Influitive, ReviewTrackers, Podium, Referral Factory, Bazaarvoice Platform, Yotpo, Trustpilot, SmileBack, PowerReviews, ResellerRatings, ,,,,,,
623, sisense, Microsoft Power BI, Qlik Sense, Domo, Amazon QuickSight, Looker, Google Data Studio, Elasticsearch, QlikView, ThoughtSpot, Tableau Desktop, ,,,,,,,
624, jobdiva, Bullhorn ATS & CRM, iCIMS, Zoho Recruit, CEIPAL ATS (TalentHire), Salesforce, BambooHR, Dice Open Web, Greenhouse, Vincere, SmartSearch, ,,,,,,,
625, cloudinary, Bynder, Adobe Experience Manager, Drupal, Canto, Nuxeo, Widen, Pics.io, Cloudimage, ImageKit.io, Oracle CX Marketing (formerly Oracle Marketing Cloud), ,,,,,,,
626, scalr, CloudStack, Oracle Enterprise Manager Cloud Control, (EOL) Cisco CloudCenter, Cloud Elements, Abiquo anyCloud, vRealize & vCloud Suite, CloudPortal Business Manager, AWS Systems Manager, CloudHealth by VMware, ,,,,,,,,
627, jobscience, Salesforce, Bullhorn ATS & CRM, TargetRecruit, Sage CRM, Oracle Cloud HCM, ClearCompany, CATS ATS, APS Payroll, IRIS CRM, Vtiger, ,,,,,,,
628, shippable, Jenkins, CircleCI, Bamboo, GitLab, TeamCity, Octopus Deploy, Azure DevOps Services, Travis CI, Spinnaker, GoCD, ,,,,,,,
629, microstation, Revit, SOLIDWORKS, Civil 3D, Rhino 3D, ARCHICAD, Autodesk Fusion 360, COMPRESS, OpenRoads Designer, Teamcenter, Bluebeam Revu, ,,,,,,,
630, reviewinc, Birdeye, Bazaarvoice Platform, Yotpo, Podium, Trustpilot, ReviewTrackers, SmileBack, PowerReviews, ResellerRatings, ,,,,,,,,
631, freshchat, ManyChat, tawk.to, Azure Bot Service (Microsoft Bot Framework), Twilio, Zoho SalesIQ, Drift, LiveChat, Zendesk Chat, Intercom, Olark, ,,,,,,,
632, weave, CentralReach, Allscripts Practice Management, SimplePractice, AdvancedPM, by AdvancedMD, Kareo Practice Management, NextGen® Practice Management Solutions, Cerner Practice Management (PowerWorks), TheraNest, TriZetto Core Administration (Facets, QNXT and QicLink), ,,,,,,
633, centralreach, TherapyNotes, TotalMD EHR, SimplePractice, Kareo EHR, Epic, DrChrono, eClinicalWorks, CareLogic EHR, by Qualifacts, athenaIDX (formerly Centricity Practice Solution from GE Healthcare), Salesforce Health Cloud, ,,,,,,
634, prophix, Vena, Microsoft Power BI, Workday Adaptive Planning, Planful (formerly Host Analytics), Anaplan, Oracle Hyperion, Jedox, Oracle Cloud EPM, Board, NetSuite ERP, ,,,,,,,
635, cybereason, CrowdStrike Falcon, SentinelOne, Carbon Black Endpoint, McAfee Total Protection, Microsoft Defender for Endpoint (formerly Microsoft Defender ATP), Darktrace, Sophos Intercept X, Trend Micro Apex One (formerly OfficeScan), FireEye Security Suite, ESET Endpoint Security, ,,,,,,,
636, armis, F-Secure Cloud Protection for Salesforce, Symantec Critical System Protection, Cisco Cyber Vision, Kaspersky Embedded Systems Security, McAfee Embedded Control, Microsoft Defender for IoT (formerly Azure Defender for IoT, with CyberX), Nozomi Networks Vantage, AWS IoT Device Defender, Allegro Software Products for IoT Security and Connectivity, Azure Sphere, ,,,,,,
637, egnyte, SharePoint, Dropbox, Amazon S3, Google Drive, Box, Nasuni Cloud Storage, Citrix ShareFile, Panzura CloudFS, Microsoft Teams, OneDrive, ,,,,,,,
638, delphix, Denodo, Actifio Enterprise, Oracle Data Integrator, Informatica Application ILM, Veeam Backup & Replication, Informatica MDM, TIBCO Data Virtualization, Amazon S3, Boomi, Devart ODBC Driver for Oracle, ,,,,,,,
639, universe, Ellucian Portal (formerly Luminis), NetWeaver, Liferay Digital Experience Platform (DXP), Oracle WebCenter Portal, Claromentis, OpenText Portal, Ex Libris campusM, Feedly Pro, Fiserv WC3 Client Portal, ,,,,,,,,
640, logicmonitor, SolarWinds NPM, Datadog, PRTG, LogRhythm NextGen SIEM Platform, ScienceLogic SL1, New Relic, Nagios Core, Splunk Infrastructure Monitoring, formerly SignalFx, Dynatrace, Zabbix, ,,,,,,
