390, marchex, CallRail, DialogTech, Google Marketing Platform (formerly DoubleClick), Twilio Segment, CallSource, Invoca, Post Affiliate Pro, Phonexa, CallTrackingMetrics, Analytic Call Tracking, Exotel, Convirza, LeadsPedia, ,,,,
391, neo4j, MongoDB, Azure Cosmos DB, Microsoft SQL Server, PostgreSQL, Redis, Cassandra, DataStax Enterprise, Oracle Database, Amazon DynamoDB, Google BigQuery, ,,,,,,,
392, nexthink, ThousandEyes, Aternity, ControlUp, ServiceNow IT Service Management, Lansweeper, Splunk Enterprise, Dynatrace, Ivanti IT Asset Management Suite, Nagios Core, Datadog, ,,,,,,,
393, applicantstack, Gusto, Paypro Workforce Management, Greenhouse, Bullhorn ATS & CRM, CVViZ, ADP Workforce Now, iCIMS, isolved, Bullhorn Jobscience (discontinued), WorkforceHub, powered by SwipeClock, ,,,,,,
394, recharge, Recurly, Fusebill, Zuora, Braintree, a PayPal service, Chargebee, Chargify, 2Checkout Monetization Platform, from Verifone, SaaSOptics, WooCommerce Subscriptions, FastSpring, ,,,,,
395, adjust, Firebase, AppsFlyer, Google Analytics, Branch, Singular, Mixpanel, Twilio Segment, Kochava, Amplitude Analytics, Firebase Crashlytics, ,,,,,,,
396, slicktext, Airship, EZ Texting, Braze, SimpleTexting, CleverTap, Attentive, 360dialog WhatsApp Business API, Zipwhip, Leanplum, Localytics, ,,,,,,,
397, harness, CloudBees Jenkins Platform, LaunchDarkly, Spinnaker, Bamboo, Heroku Platform, Apptio Cloudability, CloudWisdom, by Virtana (formerly Metricly), IBM UrbanCode Deploy, Tricentis qTest, Angular Feature Flags, ,,,,,,
398, firebase, AppsFlyer, Adjust Attribution, Microsoft Azure, Amazon Cognito, Node.js, Flutter, Mixpanel, Amplitude Analytics, PostgreSQL, Azure App Service, ,,,,,,,
399, sevone, TotalView, Opsview Monitor, SolarWinds NetFlow Traffic Analyzer (NTA), Foglight, PRTG, NETSCOUT nGeniusONE, Entuity, Nmap, SolarWinds ipMonitor, Juniper Mist Premium Analytics, ,,,,,,,
400, flexport, project44, FourKites, Oracle Transportation Management Cloud, Blue Yonder Luminate Logistics (formerly RedPrairie, JDA WMS), E2Open Channel Shaping, GTZShip, Descartes Logistics Technology Platform, Trimble Fleet Mobility (formerly PeopleNet), AFS Transportation Management, BlueJay GTN, BluJay Transportation Management, Bridge LCS, CloudMoyo Rail transportation Management (CRTM) suite, ,,,
401, envoy, NGINX, Robin, Azure API Management, SpaceIQ, Condeco, SwipedOn, Teem by iOFFICE, Crestron Fusion, Accruent EMS Software, Cisco DNA Spaces, ,,,,,,,
402, chartio, Microsoft Power BI, Google Data Studio, Sigma, Looker, Qlik Sense, Mode, Sisense, Databox, Grafana, Plotly Chart Studio, ,,,,,,,
403, qlikview, SAP BusinessObjects Business Intelligence (BI) Platform, Microsoft Power BI, Talend Data Integration, Google Data Studio, SAP Analytics Cloud, Celonis, Tableau Desktop, TIBCO Spotfire, Amazon QuickSight, Microsoft Azure, ,,,,,,,
404, prolexic, AddShoppers Social Login, eAssistance Pro (discontinued), Dell Endpoint Security Suite Enterprise, Crowdbooster (discontinued), OpenText Portal, Ayasdi Core, BookSteam, WellCycle InVision, LessAccounting, Infor CloudSuite Distribution, ,,,,,,,
405, insightsquared, Clari, Tableau CRM (formerly Einstein Analytics), Microsoft Power BI, Gong, Tableau Desktop, People.ai, Salesforce, Salesloft, Zoho Analytics, Factiva, ,,,,,,,
406, auth0, Amazon Cognito, Google Authenticator, Cisco Secure Access by Duo, Azure Active Directory, Workspace ONE Access (formerly VMware Identity Manager), Firebase, Transmit Security, SailPoint Identity Platform, OneLogin, JumpCloud, ,,,,,,,
407, kenshoo, Google Ads, Marin Software, Google Marketing Platform (formerly DoubleClick), Smartly.io, Basis, Salesforce Advertising Studio, Adobe Advertising Cloud, Marketing Solutions by Criteo, Acquisio, Kevel (formerly Adzerk), ,,,,,,,
408, changepoint, Planview Enterprise One, Salesforce, Oracle Cloud ERP, Azure DevOps Services, Jira Software, Planview Daptiv, FinancialForce PSA, ServiceNow IT Service Management, Atlassian Jira Align (formerly AgileCraft), Smartsheet, ,,,,,,,
409, lessonly, Trainual, Degreed, Articulate 360, MindTickle, Brainshark, Articulate Storyline, Guru, Tovuti LMS, Rise, LearnUpon, ,,,,,,,
410, gotomeeting, Microsoft Teams, Zoom, Google Meet, GoToAssist, Adobe Connect, Microsoft Endpoint Manager (Microsoft Intune + SCCM), TeamViewer, BlueJeans Meetings, GoTo Room, GoToMyPC, ,,,,,,,
411, nginx, Microsoft IIS, Azure Application Gateway, Amazon API Gateway, Amazon CloudFront, Cloudflare, BIG-IP, Kemp LoadMaster, Apigee Edge, Amazon Route 53, AWS WAF, ,,,,,,,
412, kindful, Bloomerang, Salesforce.org Nonprofit Cloud, Neon CRM, Virtuous CRM, Classy, DonorPerfect, Blackbaud eTapestry, Blackbaud CRM, Network for Good, Raiser's Edge, ,,,,,,,
413, kochava, AppsFlyer, Firebase, Branch, Adjust Attribution, Singular, Google Analytics, Adobe Analytics, TUNE (formerly HasOffers), Netcore Smartech, Flurry Analytics, ,,,,,,,
414, intralinks, Datasite, DealRoom, Firmex Virtual Data Room, SharePoint, Box, Egnyte, OneDrive, HighQ, Citrix ShareFile, Google Drive, ,,,,,,,
415, sprinklr, Salesforce Social Studio, Opal, Sprout Social, Salesforce, Brandwatch, Hootsuite, Khoros Marketing (Formerly Spredfast + Lithium), Google Analytics, Meltwater Media Intelligence Platform, Meta for Business (formerly Facebook for Business), ,,,,,,,
416, clickdimensions, HubSpot Marketing Hub, Microsoft Dynamics 365 Marketing, Adobe Marketo Engage, Google Analytics, Salesforce Marketing Cloud Email Studio, Salesforce, Mailchimp, Hootsuite, Litmus, ActiveCampaign, ,,,,,,,
417, fluentd, Logstash, SolarWinds Loggly, SolarWinds Kiwi Syslog Server, SolarWinds Papertrail, Graylog, SolarWinds Log Analyzer (LA), Logz.io, Rapid7 InsightOps (formerly Logentries), ArcSight Logger, ,,,,,,,,
418, net2phone, CallFire, Ooma Office, Google Hangouts (Classic), 8x8 X Series, RingCentral MVP, Fuze, Google Voice, Webex Calling, NetFortris (formerly Fonality), GoTo Connect, Cisco Unified Communications Manager (Call Manager), ,,,,,,
419, insitecommerce, Magnolia, BigCommerce, Ecwid by Lightspeed, SAP Commerce Cloud, commercetools, GoDaddy, Shopify Plus, Dokan, Kajabi, Kentico Xperience, ,,,,,,,
420, adform, Salesforce Audience Studio (formerly Salesforce DMP), Adobe Audience Manager, The Trade Desk, Google Ad Manager, Google Marketing Platform (formerly DoubleClick), AdRoll, Marketing Solutions by Criteo, Adobe Advertising Cloud, LinkedIn Lead Accelerator (Discontinued), AppNexus, OpenX, Skai (formerly Kenshoo), ,,,,,
421, schedulefly, HotSchedules, 7shifts, Toast Payroll & Team Management, formerly StratEx, ADP Workforce Now, ADP ezLaborManager, WorkforceHub, powered by SwipeClock, When I Work, UKG Pro, Jolt, Calendly, ,,,,,
422, ecwid, WordPress, WooCommerce, GoDaddy, Weebly, Squarespace, Magento Open Source, Shift4Shop (formerly 3dcart), Big Cartel, Webflow, Affirm, ,,,,,,,
423, vinsolutions, vAuto Provision, IDMS by DealerSocket, CDK Drive, ERA-IGNITE, Dealer.com, CDK Elead, vAuto Conquest, Dealertrack, Auto/Mate by DealerSocket, ,,,,,,,,
424, liveagent, Zendesk Support Suite, Freshdesk, LivePerson Conversation Cloud (LiveEngage), LiveChat, Amazon Connect, Help Scout, Front, HappyFox Help Desk, Zoho Desk, Genesys PureConnect, ,,,,,,,
425, awin, Everflow - Partner Marketing Platform, Impact, Post Affiliate Pro, Rakuten Advertising, Affise, ClickBank, Pepperjam Ascend, Tapfiliate, CAKE Affiliate Marketing Software, ,,,,,,,,
426, vertex, Avalara, ONESOURCE, TaxJar, Amazon SageMaker, Sovos Intelligent Compliance Cloud, Oracle Cloud ERP, SAP ERP, Canopy, CCH SureTax, Workday Financial Management/Revenue Management, ,,,,,,,
427, retargeting, Klaviyo, Adobe Marketo Engage, HubSpot Marketing Hub, Pardot, ActiveCampaign, Oracle CX Marketing (formerly Oracle Marketing Cloud), SharpSpring from Constant Contact, Act-On, Keap, Adobe Campaign, ,,,,,,,
428, xola, Intellimize, Calendly, Acuity Scheduling, a Squarespace company, Doodle, Chili Piper, Booker, ScheduleOnce, YouCanBook.Me, 10to8 Appointment Scheduling Software, Engageware (formerly TimeTrade), ,,,,,,
429, bandwidth, Telegram, Twilio, Webex Calling, GoTo Connect, Sinch, Plivo, Vonage Communications APIs (formerly Nexmo), Genesys PureConnect, TextMagic, MessageBird, ,,,,,,,
430, hellosign, Adobe Acrobat Sign, DocuSign, PandaDoc, SignRequest, SignNow, Proposify, eversign, emSigner, Scrive eSign, Formstack Sign (formerly InsureSign), ,,,,,,,
431, servicemax, Salesforce, ServiceNow IT Service Management, IBM Maximo, Salesforce Field Service (Click Field Service Edge), Oracle Service (formerly Oracle Service Cloud), Microsoft Dynamics 365, ServiceTitan, SAP CRM, Jobber, IFS Field Service Management, ,,,,,,,
432, activecampaign, Freshdesk, Keap, Klaviyo, Twilio SendGrid, Sendinblue, Freshworks CRM (formerly Freshsales), Mautic, Pardot, Salesforce, Vbout, ,,,,,,,
433, zencoder, JW Player, Wistia, Hapyak, Akamai, IBM Watson Media's Video Streaming, Vidyard, Vimeo, Kaltura, Cincopa, Flipgrid, Panopto, Ensemble Video, ,,,,,
434, equinix, AT&T Data Center Outsourcing, IBM Data Center Outsourcing, DXC Data Center Managed Services, Dell Data Center IT Outsourcing Services, Digital Realty, HPE Data Center Outsourcing (Pointnext Services), Rackspace Colocation Services, Data Sourcing Outsourcing, CDNetworks Colocation Services, ,,,,,,,,
435, brainshark, Articulate 360, Lessonly, Qstream, MindTickle, Seismic, Vidyard, Highspot, Ambition, Bloomfire, Cornerstone OnDemand, ,,,,,,,
436, saba, Credly, SAP SuccessFactors, Degreed, Cornerstone OnDemand, SumTotal Talent Development, Moodle, SAP Litmos, Saba TalentSpace (formerly Halogen), Oracle Cloud HCM, Articulate Storyline, ,,,,,,,
437, donordrive, Blackbaud Luminate Online, Classy, GoFundMe Charity (formerly CrowdRise), Blackbaud Online Express, iWave, Neon Fundraise (formerly Rallybound), Neon CRM, Blackbaud Raiser's Edge NXT, Blackbaud TeamRaiser, ,,,,,,,,
438, optimove, Emarsys, Pega Platform, Acoustic Campaign (formerly IBM Watson Campaign Automation), Adobe Marketo Engage, TrackMaven, Bloomreach Commerce Experience Cloud, InfiniGrow, NetBase Quid, TapClicks, Leadfeeder, Bizible, Supermetrics, DashThis, Amazon Marketing Cloud, Singular, ,,
439, microstrategy, Microsoft Power BI, IBM Cognos Analytics with Watson, SAP BusinessObjects Business Intelligence (BI) Platform, Amazon QuickSight, Qlik Sense, Tableau Desktop, Microsoft BI (MSBI), Pentaho, Google Data Studio, SAS Advanced Analytics, ,,,,,,,
440, ambition, LevelEleven, Hoopla, Centrical, Brainshark, Revenue.io (formerly RingDNA), Zoho Motivator, Microsoft Dynamics 365 - Gamification (FantasySalesTeam), deprecated, Kahoot!, Bunchball Nitro, TalentCards, ,,,,,,
441, showpad, Highspot, Seismic, Paperflite, HubSpot Sales Hub, Allego Sales Enablement Platform, Gong, Salesforce, Terminus ABM Platform, Bigtincan, Brainshark, ,,,,,,,
442, fullstory, Quantum Metric, Contentsquare (Clicktale), Hotjar, Amplitude Analytics, Adobe Analytics, Mixpanel, Smartlook, Pendo.io, Heap, Google Analytics, ,,,,,,,
443, acquia, Pantheon, Adobe Experience Manager, WordPress, Contentful, Microsoft Azure, Drupal, Liferay Digital Experience Platform (DXP), Optimizely Content Cloud (formerly Episerver Content Cloud), Amazon Web Services, Kentico Xperience, ,,,,,,,
444, starburstdata, AddShoppers Social Login, eAssistance Pro (discontinued), Dell Endpoint Security Suite Enterprise, Crowdbooster (discontinued), OpenText Portal, Ayasdi Core, BookSteam, WellCycle InVision, LessAccounting, Infor CloudSuite Distribution, ,,,,,,,
445, tufin, AlgoSec, FireMon, Skybox Security, Palo Alto Panorama, Ansible, ManageEngine Firewall Analyzer, Titania Nipper, NetBrain, RedSeal, Splunk Enterprise, ,,,,,,,
446, emma, Constant Contact, Salesforce Marketing Cloud Email Studio, Sailthru, Mailchimp, ActiveCampaign, Sendinblue, Omnisend, HubSpot Marketing Hub, Demandforce, GetResponse, ,,,,,,,
447, ams360, Applied Epic, Sagitta, QQCatalyst, EZLynx Agency Management, Applied TAM, Vertafore ReferenceConnect, AgencyBloc, Partner Platform, Zywave Sales Cloud - Agency Management (AMS) (formerly BrokerageBuilder), ,,,,,,,,
448, vision6, Twilio SendGrid, Constant Contact, Salesforce Marketing Cloud Email Studio, Litmus, Sendinblue, Bronto Marketing Platform (discontinued), Zoho Campaigns, AWeber, iContact, ,,,,,,,,
449, hive, SQLite, Accelo, Asana, Cassandra, Databricks Lakehouse Platform, PostgreSQL, Jira Software, Apache Drill, Trello, Todoist: To-Do List & Task Manager, ,,,,,,,
450, adtech, Google Marketing Platform (formerly DoubleClick), The Trade Desk, Google Ad Manager, Google Ads, Outbrain, PubMatic, Yahoo Gemini! (Verizon Media Native), formerly Yahoo! Advertising, Taboola, Marketing Solutions by Criteo, Basis, ,,,,,,
451, appsflyer, Firebase, Google Analytics, Branch, Adjust Attribution, App Annie, Singular, CleverTap, Kochava, Amplitude Analytics, Firebase Crashlytics, ,,,,,,,
452, uscreen, Datazoom, Muvi, Adobe Primetime, Akamai Adaptive Media Delivery, THUNDERSTORM, Enveu, Wowza Streaming Cloud, Accedo One, ApsaraVideo Live, ,,,,,,,,
453, spectrum, Alexandria POS, ShopKeep, Square POS, PayPal Zettle, Clover, Lightspeed Retail, Revel Systems, Sage Pay, Kounta, QuickBooksPOS, ,,,,,,,
454, macola, SAP Manufacturing Execution, NetSuite ERP, Sage 100cloud, Microsoft Dynamics AX (Dynamics 365 for Finance and Operations), discontinued, Microsoft Dynamics SL, Epicor Kinetic (formerly Epicor ERP), Oracle Cloud ERP, QAD, Infor M3, Acumatica, ,,,,,,
455, appium, Katalon Studio, Xamarin, Appian, Android Studio, Micro Focus UFT Mobile, BrowserStack, TestComplete, Postman, Selenium, Firebase, ,,,,,,,
456, esentire, Arctic Wolf, CIENCE, CDW, Taegis ManagedXDR, Mandiant Managed Defense, Softchoice, Ingram Micro, SentinelOne Vigilance, Webroot Security Awareness Training, Cybereason MDR, ,,,,,,,
457, invoca, CallRail, Genesys Multicloud CX (formerly Genesys Engage), Gong, NICE Nexidia Analytics, DialogTech, Five9, CallTrackingMetrics, Phonexa, Marchex, Twilio Segment, ,,,,,,,
458, helpdesk, Zendesk Support Suite, ConnectWise Manage, Salesforce Service Cloud, Freshdesk, Spiceworks Help Desk, Oracle Service (formerly Oracle Service Cloud), LiveAgent, Zoho Desk, TeamSupport, ,,,,,,,,
459, epiccare, Epic Cadence, Epic, Meditech Electronic Health Records, Modernizing Medicine®’s Healthcare IT Suite, InterSystems TrakCare, SAP BPM, Casamba Clinic, Practice Fusion, eMDs Plus, Exercise Pro Live, ,,,,,,,
460, netsparker, PortSwigger Burp Suite, Veracode, SonarQube, Rapid7 AppSpider, Tenable.io, Qualys WAS, Metasploit, HCL AppScan, Acunetix by Invicti, Wireshark, ,,,,,,,
461, walkme, Pendo.io, Whatfix, Chameleon, Appcues, ClickLearn, Spekit, Intercom, Google Analytics, Adobe Experience Manager, Hotjar, ,,,,,,,
462, onpage, PagerDuty, OpsGenie, xMatters, Freshstatus, AWS Security Hub, DERDACK Enterprise Alert, Everbridge IT Alerting, Squadcast, AlertOps, ,,,,,,,,
463, rabbitmq, Google Cloud Pub/Sub, IBM MQ, Amazon SQS, TIBCO Enterprise Message Service, Redis, Microsoft BizTalk, Amazon SNS, TIBCO Rendezvous, Apache Kafka, Oracle Service Bus, ,,,,,,,
464, hackerone, Bugcrowd, CrowdStrike Falcon, Rapid7 InsightVM (Nexpose), PortSwigger Burp Suite, Tanium, Ivanti Security Controls, Wireshark, Metasploit, Qualys Cloud Platform, Microsoft Defender for Endpoint (formerly Microsoft Defender ATP), ,,,,,,,
465, tipalti, Bill.com, Payoneer, Airbase, AvidXchange, Beanworks, by Quadient, Concur Invoice, Stampli, Coupa, TransferWise, MineralTree, ,,,,,,
466, totango, Gainsight Customer Cloud, ChurnZero, Planhat, HubSpot Marketing Hub, Salesforce, ClientSuccess, Pendo.io, Custify, SharpSpring from Constant Contact, Freshsuccess (formerly Natero), ,,,,,,,
467, mobiniti, Act-On, EZ Texting, Braze, SimpleTexting, CleverTap, Attentive, 360dialog WhatsApp Business API, Zipwhip, Leanplum, Localytics, ,,,,,,,
468, livestorm, Zoom Video Webinar, EverWebinar, BigMarker, Hopin, Microsoft Teams, GoTo Webinar, Zoom, Signal Open Source Messenger, Tencent VooV Meeting (TVM), Webinato, ,,,,,,,
469, spinnaker, Azure DevOps Services, Octopus Deploy, Ansible, TeamCity, Bamboo, AWS CodePipeline, IBM UrbanCode Deploy, GitLab, Terraform, JFrog Artifactory, ,,,,,,,
470, qualified, Drift, ZoomInfo Chat (formerly Insent), Intercom, LiveChat, Exceed.ai, Conversica, Olark, Zendesk Chat, Five9, Zoho SalesIQ, ,,,,,,,
471, donorperfect, Raiser's Edge, Salesforce, Bloomerang, Blackbaud eTapestry, Blackbaud CRM, Network for Good, HubSpot Marketing Hub, Kindful, a Bloomerang product, Classy, Neon CRM, ,,,,,,
472, mapr, Hadoop, Cloudera Data Platform, Apache Hive, Apache Spark, Amazon EMR, Cloudera Enterprise Data Hub, Cloudera Manager, Azure HDInsight, Oracle Big Data Cloud Service, Databricks Lakehouse Platform, ,,,,,,,
473, xactly, Varicent Incentive Compensation Management, SAP Commissions (formerly Callidus Commissions), Anaplan, Optymyze, CaptivateIQ, Spiff, QuotaPath, Xactly CEA, Jedox, Xactly SimplyComp, ,,,,,,,
474, clickmeeting, Zoom, GoTo Webinar, Microsoft Teams, WebinarJam, Google Meet, Zoom Video Webinar, Vimeo, Hopin, BigMarker, GoTo Meeting, ,,,,,,,
475, searchspring, Algolia, WooCommerce, Shopify Plus, Yext, Klevu, Bloomreach Commerce Experience Cloud, Kibo Personalization, powered by Monetate & Certona, BigCommerce, Salesforce Commerce Cloud, Coveo Qubit, ,,,,,,
476, mailgun, Amazon SES, Mailchimp, Mailjet, from Pathwire, Twilio SendGrid, SMTP Email Relay Solutions, Sendinblue, Constant Contact, SparkPost, HubSpot Marketing Hub, AWeber, ,,,,,,
477, olark, Zendesk Chat, Freshdesk Messaging (Formerly Freshchat), tawk.to, Qualified, Twilio, Intercom, AliveChat, ClickDesk, Userlike, LiveChat, ,,,,,,,
478, tegile, Pure Storage FlashArray, Tintri VMstore, HPE Nimble Storage, Dell EMC Unity, Dell EMC VMAX All Flash Storage, NetApp AFF A-Series All Flash Arrays, NetApp SolidFire, HPE 3PAR StoreServ Storage, Dell EMC SC Series, EMC VNX (Discontinued), ,,,,,,,
479, edcast, Degreed, Cornerstone OnDemand, Totara LMS, CrossKnowledge Learning Suite, Udemy for Business, Auzmor Learn, BizLibrary, Fuse, Adobe Captivate Prime, Rippling, ,,,,,,,
480, hootsuite, Canva, Later, Salesforce Social Studio, Semrush, Falcon.io, Meltwater Media Intelligence Platform, Sprout Social, Google Analytics, Zoho Social, CoSchedule Marketing Suite, ,,,,,,,
481, skype, Zoom Phone, Google Meet, Zoom, Adobe Connect, Whereby, Microsoft Teams, TeamViewer, Twilio, Google Classroom, AnyDesk, ,,,,,,,
482, appriver, Microsoft Exchange, Barracuda Email Security Gateway, Zix Email Threat Protection, Proofpoint Email Protection, Proofpoint Information Protection, Mimecast Secure Email Gateway, Zix Email Encryption (ZixEncrypt), Citrix ShareFile, Virtru, Veeam Backup for Microsoft Office 365, ,,,,,,,
483, chef, Microsoft Endpoint Manager (Microsoft Intune + SCCM), Terraform, Jenkins, Vagrant, Jamf Now, Tanium, Bamboo, Ansible, Octopus Deploy, GitLab, ,,,,,,,
484, privy, Klaviyo, Mailchimp, Omnisend, MailerLite, OptinMonster, GetResponse, Drip Ecommerce CRM, Justuno Pop-Ups & CRO Tools, Sendinblue, HubSpot Marketing Hub, ,,,,,,,
485, livehire, CareerBuilder Applicant Tracking (formerly Luceo), BambooHR, Sage People, Bullhorn ATS & CRM, JobDiva, LinkedIn Talent Hub, SAP SuccessFactors, iCIMS, SmartRecruiters, Greenhouse, Jobvite, JazzHR, Lever, ,,,,
486, shipbob, Ordoro, ShipMonk, ShipStation, Pirate Ship, Narvar, ShippingEasy, Shippo, Happy Returns, AfterShip, Deliverr, Dropex, ,,,,,,
487, messagebird, Twilio, WhatsApp Business, Sinch, Genesys PureConnect, Plivo, Amazon SNS, Vonage Communications APIs (formerly Nexmo), Infobip, Bandwidth, Five9, ,,,,,,,
488, klevu, Algolia, Searchspring, Amazon Elasticsearch Service, Apache Solr, Elasticsearch, Amazon CloudSearch, Yext, Elastic Enterprise Search (Swiftype), Google Search Appliance (discontinued), Azure Cognitive Search, ,,,,,,,
489, riskified, Kount, Signifyd Commerce Protection Platform, IBM Trusteer, Sift Digital Trust & Safety Suite, NICE Actimize, Oracle Adaptive Access Manager, ClickGUARD, SEON. Fraud Fighters, CGI HotScan360, F5 Shape Security, ,,,,,,,
490, plaid, Mambu, Oracle FLEXCUBE, Premier Bank Platform, Synapse (formerly SynapseFi), SAP for Banking, CGI Open Finance, TCS BaNCS, Temenos Transact - Core Banking, Avaloq Banking Suite, Fiserv Precision, PROFITS, ,,,,,,
491, drip, Klaviyo, Omnisend, Squarespace, Sendinblue, Privy, Sales Engine International, ActiveCampaign, GetResponse, Mautic, Sugar Sell (SugarCRM), ,,,,,,,
492, shipworks, ShipStation, Happy Returns, Pirate Ship, Narvar, ShippingEasy, Shippo, AfterShip, Deliverr, Dropex, ,,,,,,,,
493, litmus, Email on Acid, Everest (Return Path + 250ok), Salesforce Marketing Cloud Email Studio, Twilio SendGrid, Sendinblue, Pardot, Adobe Marketo Engage, Knak., ClickDimensions, SAP Litmos, ,,,,,,,
494, pureconnect, Genesys Cloud CX (formerly Genesys Cloud), Genesys Multicloud CX (formerly Genesys Engage), Amazon Connect, Cisco Unified Contact Center, Aspect Unified IP, NICE CXone (formerly NICE inContact), Microsoft Teams, Microsoft Dynamics 365, Verint Workforce Engagement (discontinued), Twilio, ,,,,,,,
495, observeit, Teramind, Forcepoint DLP, Digital Guardian, Azure Active Directory, Varonis Data Security Platform, Trend Micro Apex One (formerly OfficeScan), BeyondTrust Privileged Remote Access, BigID, CyberArk Privileged Account Security, BeyondTrust Endpoint Privilege Management, ,,,,,,,
496, quiq, Antavo, Humanity, MURAL (formerly Mural.ly), Bigtincan, Centrical, SAP Conversational AI, Azure Bot Service (Microsoft Bot Framework), ManyChat, AWS Chatbot, Dialogflow (formerly Api.ai), ZoomInfo Chat (formerly Insent), ChatBot, Landbot, Amazon Lex, ,,,
497, netdocuments, iManage Work, Worldox GX4, Google Drive, Box, Adobe Acrobat DC, HighQ, Dropbox, Nitro Productivity Suite, OpenText Content Suite Platform, Litera Compare, ,,,,,,,
498, jotform, SurveyMonkey, Google Forms, Qualtrics, Cognito Forms, Zoho Forms, Typeform, Formstack Forms, ProProfs Quiz Maker, Eventbrite, SurveySparrow, ,,,,,,,
499, learnupon, Articulate 360, SAP Litmos, Workday HCM, Docebo Learning Suite, Skilljar Customer Education Software, Degreed, Lessonly, Rise, Udemy for Business, Absorb LMS, ,,,,,,,
500, tokenex, Armor, Forcepoint Web Security, AWS CloudTrail, Trend Micro Cloud One - Workload Security (formerly Deep Security), Cisco TrustSec, F-Secure Cloud Protection for Salesforce, Palo Alto Networks Prisma Cloud, Check Point CloudGuard Posture Management (formerly Dome9), Apigee Sense, ,,,,,,,,
501, signifyd, Riskified, Sift Digital Trust & Safety Suite, SEON. Fraud Fighters, Kount, IBM Trusteer, CGI HotScan360, ClickGUARD, F5 Shape Security, Oracle Adaptive Access Manager, NICE Actimize, ,,,,,,,
502, litmos, SAP SuccessFactors, Canvas, Capterra, Articulate 360, Cornerstone OnDemand, Docebo Learning Suite, LinkedIn Learning (Lynda.com), Rise, Paycor, Ceridian Dayforce HCM, ,,,,,,,
503, browserstack, Sauce Labs, LambdaTest, AWS Device Farm, Perfecto, by Perforce, Selenium, Appium, JMeter, Xamarin, Katalon Studio, Postman, ,,,,,,
504, act-on, HubSpot Marketing Hub, Adobe Marketo Engage, Salesforce Marketing Cloud Email Studio, ActiveCampaign, Pardot, GoldMine, Microsoft Dynamics 365 Marketing, Mailchimp, Constant Contact, Zendesk Support Suite, ,,,,,,,
505, rollworks, AdRoll, 6sense, Terminus ABM Platform, Demandbase, Google Ads, Triblio, N.Rich, Bombora, ABM Essentials, powered by Marketo Engage, The Trade Desk, ,,,,,,
506, centrify, The Okta Identity Cloud, Cisco Secure Access by Duo, Workspace ONE Unified Endpoint Management (UEM, SailPoint Identity Platform, Amazon Cognito, Atlassian Crowd, Azure Active Directory, Oracle Identity Governance, Imprivata OneSign, 1Password, ,,,,,,,
507, datorama, Microsoft Power BI, Tableau Desktop, Google Data Studio, Tableau CRM (formerly Einstein Analytics), Salesforce Marketing Cloud Email Studio, Google Analytics, Supermetrics, Adobe Analytics, Google Analytics 360 (formerly Google Analytics Premium), Domo, ,,,,,,,
508, go1, Articulate Storyline, Lessonly, Adobe Captivate, LinkedIn Learning (Lynda.com), Coursera, Infosec Skills, Pluralsight Skills, A Cloud Guru (Linux Academy), Udemy for Business, Skillsoft Leadership Development Program, ITProTV, ,,,,,,
509, simulink, SOLIDWORKS, Altair Inspire, ETAP PS, Autodesk Fusion 360, SimScale, Arena PLM and QMS, PTC Creo, SIMULIA, MATLAB, Teamcenter, ,,,,,,,
510, kibana, Microsoft Power BI, Apache Kafka, Amazon QuickSight, Google Data Studio, Datadog, Amazon CloudWatch, Google Analytics, New Relic, Qlik Sense, Prometheus, ,,,,,,,
511, shipmonk, Pirate Ship, Easyship, Happy Returns, ShippingEasy, ShipStation, Narvar, Shippo, AfterShip, Deliverr, Dropex, ,,,,,,,
512, addigy, Microsoft Endpoint Manager (Microsoft Intune + SCCM), Jamf Pro, Citrix Endpoint Management, Central, Fleetsmith, MobileIron Acquired by Ivanti, Sophos Mobile, N-able RMM, N-able N-central, Cisco Meraki SM, ,,,,,,,
513, mediafly, Paperflite, Seismic, Highspot, Modus, Brainshark, SocialPort, Gong, MindTickle, Showpad Content, SalesHood, Allego Sales Enablement Platform, worxogo Nudge Coach, Dooly, ,,,,
514, infobip, Sinch, Twilio, MessageBird, Vonage Communications APIs (formerly Nexmo), Google Analytics, TextMagic, Bandwidth, Genesys PureConnect, Vonage Business Communications, Plivo, ,,,,,,,
515, archibus, SpaceIQ, Tririga, Accruent EMS Software, IBM Maximo, Primavera Unifier, Crestron Fusion, iOFFICE, ServiceNow IT Service Management, OfficeSpace Software, Yardi Voyager, ,,,,,,,
516, unbxd, Elasticsearch, Yext, Apache Solr, Amazon CloudSearch, Algolia, Google Search Appliance (discontinued), Azure Cognitive Search, Amazon Elasticsearch Service, Searchspring, ,,,,,,,,
517, namely, BambooHR, Rippling, Ceridian Dayforce HCM, ADP Workforce Now, Workday HCM, Gusto, Zenefits, Paycom, Sage HRMS, TriNet, ,,,,,,,
